Name,Image Link,Rating,Price(£),In-Stock,Category
Red Dragon (Hannibal Lecter #1),../../media/cache/4a/ce/4acec5ebebf374e7a84a5d8c74ee5752.jpg,Three,23.37,5,horror
Peak: Secrets from the New Science of Expertise,../../media/cache/7c/04/7c04c7a92b5ba83361eba81fa364a2ca.jpg,Two,16.28,5,science
My Mother Was Nuts,../../media/cache/65/67/6567e9868a3d1196f32c063c0f73ea01.jpg,Four,31.63,5,nonfiction
Mexican Today: New and Rediscovered Recipes for Contemporary Kitchens,../../media/cache/c2/19/c219b1be1e325abd2244ace190870569.jpg,Five,24.91,5,food-and-drink
Maybe Something Beautiful: How Art Transformed a Neighborhood,../../media/cache/89/9a/899a07816ced14262169345493bbbe51.jpg,One,22.54,5,childrens
Lola and the Boy Next Door (Anna and the French Kiss #2),../../media/cache/1e/12/1e12b33f2f3988b23f895d2319ef7af8.jpg,Four,23.63,5,young-adult
Logan Kade (Fallen Crest High #5.5),../../media/cache/2b/44/2b4404e00c242bf1b8263bdd99c07354.jpg,Two,13.12,5,academic
Last One Home (New Beginnings #1),../../media/cache/0b/98/0b98d840b298be76c1a982a8d1f4688f.jpg,Three,59.98,5,fiction
Killing Floor (Jack Reacher #1),../../media/cache/b1/5b/b15b4c864b762133cdaf69b58ba55d76.jpg,Four,31.49,5,thriller
Kill the Boy Band,../../media/cache/6e/66/6e66e7cefe3ca7cf9402f87f3e13c79e.jpg,Five,15.52,5,young-adult
Isla and the Happily Ever After (Anna and the French Kiss #3),../../media/cache/61/ff/61ffcc9619675c79b1f0b568d6ee870c.jpg,Five,48.13,5,young-adult
If I Stay (If I Stay #1),../../media/cache/c2/62/c262c55a104878043319173d79986c89.jpg,Five,38.13,5,default
I Know Why the Caged Bird Sings (Maya Angelou's Autobiography #1),../../media/cache/3b/f1/3bf1eded8dda102ca3f572540273f587.jpg,Two,36.55,5,default
Harry Potter and the Deathly Hallows (Harry Potter #7),../../media/cache/d6/2b/d62b299736dda60f16eb4c5b23f81a82.jpg,One,23.32,5,default
"Fruits Basket, Vol. 5 (Fruits Basket #5)",../../media/cache/8e/25/8e259f84683adbaa30452df5aaa142b3.jpg,One,16.33,5,sequential-art
Foundation (Foundation (Publication Order) #1),../../media/cache/da/a0/daa08c54a927c27494ea5bb90af79c60.jpg,One,32.42,5,science-fiction
Fool Me Once,../../media/cache/2e/ba/2eba785f249284b61928d98972c1b2ca.jpg,One,16.96,5,default
Find Her (Detective D.D. Warren #8),../../media/cache/48/4d/484d8afc2cf8b77a45fa4fec0a5e7b89.jpg,One,22.37,5,add-a-comment
Evicted: Poverty and Profit in the American City,../../media/cache/db/27/db27a90497bcb1b1d8e59dec06264256.jpg,One,42.27,5,add-a-comment
Drama,../../media/cache/46/04/4604cba3ffbb4936dd3edb9cbfe26393.jpg,Two,38.70,5,default
Dracula the Un-Dead,../../media/cache/b1/f2/b1f25fa4623b3ee2db6fb6d6e27c6fb5.jpg,Five,35.63,5,horror
Digital Fortress,../../media/cache/86/78/86786e20ec80b5b3ec66657870750b73.jpg,Five,58.00,5,fiction
"Death Note, Vol. 5: Whiteout (Death Note #5)",../../media/cache/93/d9/93d98563d32936ffd8db2c19f7857478.jpg,One,52.41,5,sequential-art
"Data, A Love Story: How I Gamed Online Dating to Meet My Match",../../media/cache/f2/c5/f2c56824a5aef38387350243762216eb.jpg,Three,32.35,5,nonfiction
Critique of Pure Reason,../../media/cache/3b/28/3b28ec3663a81d36272a08e5a49644f2.jpg,One,20.75,5,philosophy
Booked,../../media/cache/cf/3b/cf3b0341f5f4f4ad2c1439c11d32a9b1.jpg,Five,17.49,5,poetry
"Blue Lily, Lily Blue (The Raven Cycle #3)",../../media/cache/16/67/16674db55d7c7c37bf19e1aed4a8cc57.jpg,Five,34.13,5,default
Approval Junkie: Adventures in Caring Too Much,../../media/cache/96/6d/966d8d2afdead087cba0f29a69f89ba5.jpg,Five,58.81,5,autobiography
An Abundance of Katherines,../../media/cache/9b/c8/9bc86bc10a6beea536422bbe82e076fb.jpg,Five,10.00,5,young-adult
America's War for the Greater Middle East: A Military History,../../media/cache/da/0c/da0ca0d6586f8164b7a96d4c807a6c7f.jpg,Two,51.22,5,history
Alight (The Generations Trilogy #2),../../media/cache/43/74/43749a90eed0e03d9975116ad44fbde3.jpg,Four,58.59,5,default
A Girl's Guide to Moving On (New Beginnings #2),../../media/cache/17/94/17940ad8d367ea5f28db57e7fc32dac9.jpg,One,31.30,5,romance
A Game of Thrones (A Song of Ice and Fire #1),../../media/cache/37/09/3709ede7460008ec539deb7cd44b688e.jpg,Two,46.42,5,add-a-comment
A Feast for Crows (A Song of Ice and Fire #4),../../media/cache/6f/b7/6fb724034c86041a52b247ae53613413.jpg,Four,17.21,5,fantasy
A Clash of Kings (A Song of Ice and Fire #2),../../media/cache/6d/73/6d739416776a66c258ef0cb35f3eb9e1.jpg,Three,10.79,5,add-a-comment
Vogue Colors A to Z: A Fashion Coloring Book,../../media/cache/09/db/09db3ae79413c88e4ca1aab30368d63d.jpg,Four,52.35,4,default
The Shining (The Shining #1),../../media/cache/ea/cb/eacbd43aaf46f527416aa5d6561b29ad.jpg,Three,27.88,4,default
The Pilgrim's Progress,../../media/cache/91/2a/912acfe6ee354d9d9bf3c1fa517c4252.jpg,Two,50.26,4,classics
The Perfect Play (Play by Play #1),../../media/cache/b0/be/b0be8b72b97ba3185f7d55235d0be76f.jpg,Three,59.99,4,romance
The Passion of Dolssa,../../media/cache/b3/59/b35975c0df26c40964028a8ccabc9a91.jpg,Five,28.32,4,historical-fiction
The Jazz of Physics: The Secret Link Between Music and the Structure of the Universe,../../media/cache/f3/d1/f3d18f7fa858139e133fe4809d3827b5.jpg,Three,38.71,4,nonfiction
The Hunger Games (The Hunger Games #1),../../media/cache/4e/9d/4e9de73d08f8c0b1b6ea859a93f1aa31.jpg,Five,29.85,4,default
The Hound of the Baskervilles (Sherlock Holmes #5),../../media/cache/9d/fe/9dfe2a73c6a1a1c09927c904de641ebf.jpg,Two,14.82,4,classics
The Gunning of America: Business and the Making of American Gun Culture,../../media/cache/e2/23/e223db017107fcccf532e5fe753f307d.jpg,Four,16.81,4,nonfiction
The Geography of Bliss: One Grump's Search for the Happiest Places in the World,../../media/cache/fd/51/fd513e918a0b34fb08bc67d1d7065e40.jpg,Two,28.23,4,nonfiction
The Demonists (Demonist #1),../../media/cache/be/f8/bef8aac75369fc2211515cd4c76d3518.jpg,Two,52.11,4,fantasy
"The Demon Prince of Momochi House, Vol. 4 (The Demon Prince of Momochi House #4)",../../media/cache/20/99/20995345e7a87cdfb4503283ae991e84.jpg,Two,27.88,4,sequential-art
The Bone Hunters (Lexy Vaughan & Steven Macaulay #2),../../media/cache/8d/1f/8d1f11673fbe46f47f27b9a4c8efbf8a.jpg,Three,59.71,4,thriller
The Beast (Black Dagger Brotherhood #14),../../media/cache/d4/76/d4761761d26eb7fe1ba0a9480913a8ca.jpg,Five,46.08,4,fantasy
Some Women,../../media/cache/2f/71/2f710e4c53d98e47b73e4d34702a6751.jpg,Five,13.73,4,womens-fiction
Shopaholic Ties the Knot (Shopaholic #3),../../media/cache/d0/f8/d0f8f438caa5e7adc1c727da4f06ca64.jpg,Five,48.39,4,womens-fiction
Paper and Fire (The Great Library #2),../../media/cache/b6/3b/b63bd741fc6ada1e60a33db14bde0277.jpg,Five,49.45,4,fantasy
Outlander (Outlander #1),../../media/cache/2e/3f/2e3f900dfa0d70799f009f1c07f54697.jpg,Five,19.67,4,default
"Orchestra of Exiles: The Story of Bronislaw Huberman, the Israel Philharmonic, and the One Thousand Jews He Saved from Nazi Horrors",../../media/cache/b5/94/b59425287ce6b186715fa7b01054c2bf.jpg,Three,12.36,4,music
No One Here Gets Out Alive,../../media/cache/8e/9b/8e9be254974e64a8a3d365a1571e3ec2.jpg,Five,20.02,4,music
Night Shift (Night Shift #1-20),../../media/cache/b8/84/b8843e0c3fbadb1682b095c99eda7f7a.jpg,Four,12.75,4,horror
Needful Things,../../media/cache/d2/d8/d2d818d6654086560072fe1d42189636.jpg,Four,47.51,4,horror
Mockingjay (The Hunger Games #3),../../media/cache/42/5a/425a156d129df73861380d9fe49c1533.jpg,Four,20.44,4,default
Misery,../../media/cache/cc/fb/ccfb8bb0f63377a67fb0a39d513f6cab.jpg,Two,34.79,4,horror
Little Women (Little Women #1),../../media/cache/55/a9/55a942b0c092c40bdbb6a1f1be340984.jpg,Four,28.07,4,classics
It,../../media/cache/f9/40/f9409b5717cc44f29aa444d85ad26bdc.jpg,Three,25.01,4,horror
Harry Potter and the Sorcerer's Stone (Harry Potter #1),../../media/cache/e7/3f/e73ff548ede8f14e62854878d86a604f.jpg,Three,13.90,4,default
Harry Potter and the Prisoner of Azkaban (Harry Potter #3),../../media/cache/27/93/2793d4ce3d27cdcdb7a0961bc218b25f.jpg,Four,24.17,4,young-adult
Harry Potter and the Order of the Phoenix (Harry Potter #5),../../media/cache/ca/56/ca565814dfe2d9f73d3d6b1ad7265984.jpg,Four,31.63,4,fantasy
Harry Potter and the Half-Blood Prince (Harry Potter #6),../../media/cache/06/ee/06ee91950f111a29d18bccb0c3418fb4.jpg,Five,48.75,4,fantasy
Harry Potter and the Chamber of Secrets (Harry Potter #2),../../media/cache/9e/3c/9e3c81f9694c5832a24bf590c2a0b610.jpg,One,14.74,4,fantasy
Gone with the Wind,../../media/cache/ac/ee/acee20cff19be38cc3efc5e9b50afae4.jpg,Three,32.49,4,classics
God Is Not Great: How Religion Poisons Everything,../../media/cache/ff/b8/ffb857154e4bc8af56f33d7277cb9939.jpg,One,27.80,4,nonfiction
Girl With a Pearl Earring,../../media/cache/b1/5e/b15ec9da5c7b28e2d11347dd2e8c20e5.jpg,One,26.77,4,historical-fiction
"Fruits Basket, Vol. 4 (Fruits Basket #4)",../../media/cache/77/0b/770bf7bcb38eaacc6a9392dd0b7af1e4.jpg,Four,50.44,4,sequential-art
Far From True (Promise Falls Trilogy #2),../../media/cache/9c/aa/9caacda3ff43984447ee22712e7e9ca9.jpg,Two,34.93,4,thriller
Dark Lover (Black Dagger Brotherhood #1),../../media/cache/d8/bd/d8bdea8d4e7db9af8e0cb1b36db448d2.jpg,One,12.87,4,romance
Confessions of a Shopaholic (Shopaholic #1),../../media/cache/02/88/0288939291a11611aacb27925d3c2d19.jpg,Two,48.94,4,default
Changing the Game (Play by Play #2),../../media/cache/7a/6a/7a6a89af2f591d86df6f7c65649463db.jpg,Three,13.38,4,romance
Candide,../../media/cache/e7/7d/e77d917c495e649216225bd47e006482.jpg,Three,58.63,4,classics
Can You Keep a Secret?,../../media/cache/e1/24/e124fe015a3ffa6857eb35c39e89cd61.jpg,One,21.94,4,womens-fiction
Atlas Shrugged,../../media/cache/9d/3c/9d3c5430a627260e4a8c9ca02c8a8924.jpg,Five,26.58,4,fiction
Animal Farm,../../media/cache/73/b9/73b9d68a89e6d037f1afdc70f96bad09.jpg,Three,57.22,4,classics
A Walk to Remember,../../media/cache/fe/a9/fea9278c15f5ad41f5d478196cf4132d.jpg,One,56.43,4,romance
A New Earth: Awakening to Your Life's Purpose,../../media/cache/13/1b/131bca3895aa2892f400020cd939cd42.jpg,Five,55.65,4,spirituality
"A History of God: The 4,000-Year Quest of Judaism, Christianity, and Islam",../../media/cache/fd/99/fd996fdccb07aa8759f1388a0dea343a.jpg,One,27.62,4,religion
'Salem's Lot,../../media/cache/d3/55/d35568710e773adf06a0bc756a99f66d.jpg,Four,49.56,4,horror
Zero History (Blue Ant #3),../../media/cache/c6/e9/c6e99bbab7370aec1922a3b37b5acbe2.jpg,One,34.77,3,default
Wuthering Heights,../../media/cache/d8/64/d8644073d00c000cb60643256080cc4b.jpg,Three,17.73,3,classics
World War Z: An Oral History of the Zombie War,../../media/cache/12/1a/121ae6f29c52eb01f2bec02407bc3e57.jpg,One,21.80,3,default
Wild: From Lost to Found on the Pacific Crest Trail,../../media/cache/d3/34/d3347aba8346ccff1dcf3751b4e5b9ab.jpg,Three,46.02,3,default
"Where'd You Go, Bernadette",../../media/cache/8e/5d/8e5d5553e08df59154701c1448b40e20.jpg,One,18.13,3,default
When You Are Engulfed in Flames,../../media/cache/42/1a/421afe48509fc8cccccad804b64c58dc.jpg,Five,30.89,3,humor
We the People: The Modern-Day Figures Who Have Reshaped and Affirmed the Founding Fathers' Vision of America,../../media/cache/b9/45/b945e870e5188ce6dabbf79ed98b10f1.jpg,Three,31.95,3,nonfiction
We Are All Completely Beside Ourselves,../../media/cache/8d/95/8d95f4fd1ea785555a28d6371444ce6d.jpg,One,24.04,3,contemporary
Walk the Edge (Thunder Road #2),../../media/cache/3f/c5/3fc5fbb8ab3099a5fae8f5d180605905.jpg,Three,32.36,3,young-adult
Voyager (Outlander #3),../../media/cache/6e/22/6e22497cbecedef59be86d1328e4b044.jpg,Five,21.07,3,historical-fiction
Very Good Lives: The Fringe Benefits of Failure and the Importance of Imagination,../../media/cache/fd/26/fd264a20852bbecf647475d968ac0409.jpg,Three,50.66,3,nonfiction
Vegan Vegetarian Omnivore: Dinner for Everyone at the Table,../../media/cache/a1/c7/a1c7dfc9ebc338043cb0420a49f58f5e.jpg,Two,13.66,3,food-and-drink
"Unstuffed: Decluttering Your Home, Mind, and Soul",../../media/cache/68/2d/682d1c7c8aa1010bd138203ae9d2d10b.jpg,One,58.09,3,nonfiction
Under the Banner of Heaven: A Story of Violent Faith,../../media/cache/0a/44/0a44a38a50b7d61facccae446cf30630.jpg,One,30.00,3,nonfiction
Two Boys Kissing,../../media/cache/a0/29/a029efdcb7e61cc2fed1f7404cf065a0.jpg,Two,32.74,3,young-adult
Twilight (Twilight #1),../../media/cache/05/22/05220e25687e267099f0aeb329b6f3cc.jpg,Two,41.93,3,default
Twenties Girl,../../media/cache/49/ec/49ec020f1dfa44313313495b809f74f1.jpg,Two,42.80,3,womens-fiction
"Trespassing Across America: One Man's Epic, Never-Done-Before (and Sort of Illegal) Hike Across the Heartland",../../media/cache/fb/65/fb6511ce55f5cf2ebf22a90655ad7c42.jpg,One,53.51,3,nonfiction
Three-Martini Lunch,../../media/cache/fc/c2/fcc2f183dde593b991e01585f5df1e09.jpg,Three,23.21,3,fiction
"Thinking, Fast and Slow",../../media/cache/7d/9b/7d9ba3173dcc0194ec63f9c77d0763cb.jpg,One,21.14,3,psychology
The Wild Robot,../../media/cache/42/48/424876ee529de5b557ebd69286c87343.jpg,Three,56.07,3,childrens
"The Wicked + The Divine, Vol. 3: Commercial Suicide (The Wicked + The Divine)",../../media/cache/33/cb/33cb44fb2984e4d09dc2263c50b36927.jpg,Three,14.41,3,sequential-art
The Undomestic Goddess,../../media/cache/e3/e9/e3e95f631eb64252324768ce795b50d7.jpg,Four,45.75,3,womens-fiction
The Travelers,../../media/cache/42/a3/42a345bdcb3e13d5922ff79cd1c07d0e.jpg,One,15.77,3,thriller
The Tipping Point: How Little Things Can Make a Big Difference,../../media/cache/ba/ab/baab7240d3d472f4f868ae8b4481365b.jpg,Two,10.02,3,add-a-comment
The Thing About Jellyfish,../../media/cache/ef/d3/efd3fd5390be3a440e28b03b5bb0fd95.jpg,One,48.77,3,childrens
The Stand,../../media/cache/f9/8b/f98bdf42af5e223bc0f6ea6bd0a48a53.jpg,Two,57.86,3,horror
The Smitten Kitchen Cookbook,../../media/cache/93/cb/93cb59d2fa8bab28812989e1a33b4cae.jpg,One,23.59,3,food-and-drink
The Silkworm (Cormoran Strike #2),../../media/cache/fa/d2/fad227281b25d606782218a33323991b.jpg,Five,23.05,3,mystery
"The Sandman, Vol. 3: Dream Country (The Sandman (volumes) #3)",../../media/cache/df/96/df96b9a9739d2421620bfb3622f3c2d0.jpg,Five,55.55,3,sequential-art
The Rose & the Dagger (The Wrath and the Dawn #2),../../media/cache/a9/b6/a9b62c069312790dd2d408b0b57a2976.jpg,Four,58.64,3,fantasy
The Road to Little Dribbling: Adventures of an American in Britain (Notes From a Small Island #2),../../media/cache/26/f5/26f5d20239a45046e756c6d09611b3ea.jpg,One,23.21,3,travel
The Rise of Theodore Roosevelt (Theodore Roosevelt #1),../../media/cache/4c/09/4c090b85892f532210e44d84b752b64d.jpg,Three,42.57,3,biography
The Restaurant at the End of the Universe (Hitchhiker's Guide to the Galaxy #2),../../media/cache/aa/8f/aa8fc991d84aca12ed94a0a2fa1099e5.jpg,One,10.92,3,science-fiction
The Rest Is Noise: Listening to the Twentieth Century,../../media/cache/fe/74/fe7494f92b03b9c178cf19a038011f18.jpg,One,34.77,3,add-a-comment
The Red Tent,../../media/cache/15/59/155942710c3ae4bd4ed622df9a999b99.jpg,Five,35.66,3,historical-fiction
The Purpose Driven Life: What on Earth Am I Here for?,../../media/cache/e8/67/e867d03f2a94d84ff1be5800a34b9a95.jpg,Three,37.19,3,add-a-comment
The Purest Hook (Second Circle Tattoos #3),../../media/cache/c2/9d/c29dbb9c163edb0e885f897063d619f3.jpg,One,12.25,3,romance
The Picture of Dorian Gray,../../media/cache/67/29/67297ff3ae6cb02884c52e5250fe7c1a.jpg,Two,29.70,3,classics
The Paris Wife,../../media/cache/c4/81/c481876e0c0057308366ba37f7413b7e.jpg,Three,36.80,3,default
The Obsession,../../media/cache/a6/38/a63804d7adf6fb90b70b226702cb4f7b.jpg,One,45.43,3,romance
The Nightingale,../../media/cache/c6/ac/c6ac29eaf9e7de9de175d014d2132428.jpg,Four,26.26,3,fiction
The New Guy (and Other Senior Year Distractions),../../media/cache/20/59/2059cab99f3edbb3971347b7a0812cdd.jpg,Three,44.92,3,young-adult
The Nanny Diaries (Nanny #1),../../media/cache/e3/4e/e34e69942bf1327c602ef9754d02a022.jpg,Five,52.53,3,womens-fiction
The Name of God is Mercy,../../media/cache/01/7c/017c9fd993b4ebb5676213f6de1f96c5.jpg,Two,37.25,3,nonfiction
The Maze Runner (The Maze Runner #1),../../media/cache/e1/56/e156706ae507fdd59aa933675a480d07.jpg,One,20.93,3,default
The Lover's Dictionary,../../media/cache/0b/e9/0be9284a6b11e3517504aa9a44f87a3a.jpg,Two,58.09,3,default
The Lonely Ones,../../media/cache/ff/f6/fff64acb3c65cbea2ac9209c2a57af17.jpg,Five,43.59,3,childrens
The Lean Startup: How Today's Entrepreneurs Use Continuous Innovation to Create Radically Successful Businesses,../../media/cache/52/6e/526e9f360da288db64ca70c89cdbcaa9.jpg,Three,33.92,3,business
The Last Painting of Sara de Vos,../../media/cache/1c/e4/1ce4c2573d65ebdc3c85d9a6592d57b1.jpg,Two,55.55,3,historical-fiction
"The Land of 10,000 Madonnas",../../media/cache/af/82/af82a0cccc29dd467330dab0325807c8.jpg,Four,29.64,3,young-adult
The Infinities,../../media/cache/c8/9e/c89ec72cf70f8d37e049223b90708a5a.jpg,One,27.41,3,fiction
The Husband's Secret,../../media/cache/95/27/9527e680e56bb3f8d9bf4e8882a3b723.jpg,Five,52.51,3,fiction
The Hitchhiker's Guide to the Galaxy (Hitchhiker's Guide to the Galaxy #1),../../media/cache/f4/00/f4000d1f2348894ec00679674a5b5d4f.jpg,Three,47.80,3,add-a-comment
The Guns of August,../../media/cache/ca/23/ca23598be538026a7898232e8a1079d0.jpg,Two,14.54,3,history
The Guernsey Literary and Potato Peel Pie Society,../../media/cache/98/e3/98e3925e5e6a66acf2cde918fc147205.jpg,One,49.53,3,historical-fiction
The Goldfinch,../../media/cache/d3/af/d3afd585a95c0b8b59f73f2948cef8c8.jpg,Three,43.58,3,default
The Giver (The Giver Quartet #1),../../media/cache/fe/a1/fea18082a98781b8e87bdf99065f4887.jpg,One,12.30,3,default
The Girl with All the Gifts,../../media/cache/9a/91/9a911066cb404976bcc25dbc8817432a.jpg,Three,49.47,3,horror
The Girl Who Played with Fire (Millennium Trilogy #2),../../media/cache/21/7f/217f8cd244c5dfbd2ed860695694f545.jpg,Two,22.14,3,default
The Girl Who Kicked the Hornet's Nest (Millennium Trilogy #3),../../media/cache/fb/c5/fbc5ed73ca9452af655115c7bd006e83.jpg,One,57.48,3,add-a-comment
The Exiled,../../media/cache/dd/29/dd29147b962e4480491cac5bce41e4e4.jpg,Three,43.45,3,mystery
"The End of Faith: Religion, Terror, and the Future of Reason",../../media/cache/69/97/69978f609f9c1cb470ce1aa0774cf9d1.jpg,Four,22.13,3,add-a-comment
"The Elegant Universe: Superstrings, Hidden Dimensions, and the Quest for the Ultimate Theory",../../media/cache/5e/db/5edba3f8d50df6306bc5aa3f2516bd0c.jpg,Four,13.03,3,science
"The Disappearing Spoon: And Other True Tales of Madness, Love, and the History of the World from the Periodic Table of the Elements",../../media/cache/47/cd/47cd27d1ae8935f974541829eea328f2.jpg,Five,57.35,3,science
The Devil Wears Prada (The Devil Wears Prada #1),../../media/cache/21/ac/21acb843702d1448519cc8bf0d5da728.jpg,One,44.29,3,womens-fiction
The Demon-Haunted World: Science as a Candle in the Dark,../../media/cache/f2/a1/f2a18461821c1842a4bc8041de6a8d40.jpg,Four,52.25,3,default
The Day the Crayons Came Home (Crayons),../../media/cache/34/b2/34b2631bafd148bcd8dcd850a4b75971.jpg,Five,26.33,3,childrens
The Da Vinci Code (Robert Langdon #2),../../media/cache/90/81/90810ccd85e7f49b9040246800a19b44.jpg,Two,22.96,3,fiction
The Cuckoo's Calling (Cormoran Strike #1),../../media/cache/72/ec/72ec24f082aba608ca37bc3aeaf57317.jpg,One,19.21,3,mystery
The Complete Stories and Poems (The Works of Edgar Allan Poe [Cameo Edition]),../../media/cache/55/2d/552d55d44dcc0f27e98b3e7dc3959e1a.jpg,Four,26.78,3,classics
The Complete Poems,../../media/cache/e5/cb/e5cb32b76ae2e45823f1d50446c9ae58.jpg,Five,41.32,3,add-a-comment
The Catcher in the Rye,../../media/cache/b4/54/b4540e3eb2e980d0c2b45c5c4432f28b.jpg,One,24.55,3,add-a-comment
The Cat in the Hat (Beginner Books B-1),../../media/cache/3c/45/3c4578b3f58e5b4afea86f886b201fd8.jpg,Two,16.26,3,childrens
The Case for Christ (Cases for Christianity),../../media/cache/fc/42/fc42d56ac8d3ee46bfea880d0cf46a5e.jpg,One,47.84,3,add-a-comment
The Book Thief,../../media/cache/54/0b/540bd6b063db9cc37fcfa7d9d8a97c7d.jpg,Two,53.49,3,default
The Book of Basketball: The NBA According to The Sports Guy,../../media/cache/73/bb/73bbe0a70806f8a732b9a7a7a343c5ec.jpg,Five,44.84,3,sports-and-games
The Blind Side: Evolution of a Game,../../media/cache/a2/2a/a22a10fdc420dce290c7c85dde23f093.jpg,Five,53.71,3,add-a-comment
The Autobiography of Malcolm X,../../media/cache/d7/4d/d74ddd5fd851eb01a201e7de7f4d5832.jpg,Two,23.43,3,default
"The Art of Simple Food: Notes, Lessons, and Recipes from a Delicious Revolution",../../media/cache/ce/50/ce507dd8849b38d2c3eebb0e691c1aab.jpg,Three,34.32,3,food-and-drink
The Art of Fielding,../../media/cache/8a/fe/8afee4ecfc952010bcb70f72e4728d16.jpg,One,22.10,3,fiction
"Surely You're Joking, Mr. Feynman!: Adventures of a Curious Character",../../media/cache/a5/50/a550edf8668b36d52d37080a804944ab.jpg,Two,25.83,3,science
Stiff: The Curious Lives of Human Cadavers,../../media/cache/00/01/0001685f344cae0e6921bc3f8256b54e.jpg,Three,36.74,3,nonfiction
Spilled Milk: Based on a True Story,../../media/cache/2e/a3/2ea30e892e0060412f854b31a4e72e47.jpg,One,49.51,3,nonfiction
Something Borrowed (Darcy & Rachel #1),../../media/cache/82/ed/82ed95c8c6c3ee6171fe3b55d766a9ec.jpg,Five,48.96,3,womens-fiction
Something Blue (Darcy & Rachel #2),../../media/cache/29/26/2926c885f673e84d7fc46240b1f77eb2.jpg,One,54.62,3,womens-fiction
Soldier (Talon #3),../../media/cache/79/15/7915bf4c3d1a2f7fd39c4edff580e91f.jpg,Two,24.72,3,fantasy
Shopaholic & Baby (Shopaholic #5),../../media/cache/75/b1/75b1b239670c929c4e17b9a67ebb6272.jpg,Two,46.45,3,default
Seven Days in the Art World,../../media/cache/92/2f/922f6fcd3282a0da76cc14fc13ae2411.jpg,Two,52.33,3,add-a-comment
Seven Brief Lessons on Physics,../../media/cache/ae/f9/aef933758e39ba5e4327b2152478bb1a.jpg,Four,30.60,3,science
Scarlet (The Lunar Chronicles #2),../../media/cache/97/04/9704e3b9203e9b029134d0b86c17613b.jpg,Four,14.57,3,young-adult
Sarah's Key,../../media/cache/36/94/3694ded38770738af6a6959636124331.jpg,One,46.29,3,add-a-comment
"Saga, Volume 3 (Saga (Collected Editions) #3)",../../media/cache/55/89/5589eb7a8127d04add1c4205186d91d4.jpg,Five,21.57,3,sequential-art
Running with Scissors,../../media/cache/4c/e1/4ce1ed40df359e001020e1ea55674381.jpg,Four,12.91,3,autobiography
Rogue Lawyer (Rogue Lawyer #1),../../media/cache/2d/d0/2dd096d0fa0af96560c16aeffea83d4a.jpg,Three,50.11,3,add-a-comment
"Rise of the Rocket Girls: The Women Who Propelled Us, from Missiles to the Moon to Mars",../../media/cache/1c/41/1c41d9cb63d3627fc60a1f3ba42da963.jpg,Four,41.67,3,nonfiction
Rework,../../media/cache/12/23/12233a9d0bf8187a988c27c6a54b3d31.jpg,Two,44.88,3,business
Reservations for Two,../../media/cache/7a/13/7a13d10c37d4b975145bfa493f69fbf0.jpg,Three,11.10,3,romance
Red: The True Story of Red Riding Hood,../../media/cache/9d/dd/9ddd21ce54bf11eb84bf6986decb9915.jpg,Three,28.54,3,childrens
Ready Player One,../../media/cache/b9/af/b9afd75c09ff7bf82c9a158a34cb993d.jpg,Four,19.07,3,science-fiction
Quiet: The Power of Introverts in a World That Can't Stop Talking,../../media/cache/15/fd/15fd39b56579a9038ad1233ceb91951d.jpg,One,43.55,3,default
Prodigy: The Graphic Novel (Legend: The Graphic Novel #2),../../media/cache/1b/8b/1b8b733db667fc3a7bbca0d65fa078f1.jpg,Three,43.63,3,sequential-art
Persepolis: The Story of a Childhood (Persepolis #1-2),../../media/cache/9d/5f/9d5f4a231a2ee898ed76f603b3e40163.jpg,One,39.13,3,sequential-art
Packing for Mars: The Curious Science of Life in the Void,../../media/cache/f1/33/f13365561defe8ad6f80c26d2216633c.jpg,Two,56.68,3,default
Outliers: The Story of Success,../../media/cache/7c/7f/7c7f3a48d03cdbdd87c07482711b72f9.jpg,One,14.16,3,nonfiction
Original Fake,../../media/cache/39/99/3999845b6800427aad3d45041586a171.jpg,Three,31.45,3,sequential-art
Orange Is the New Black,../../media/cache/c4/cf/c4cf1668dcb49c698e8cc2c6553b1237.jpg,Two,24.61,3,default
One for the Money (Stephanie Plum #1),../../media/cache/3f/7a/3f7a775ec9fe618e122e3d3b4f91dc22.jpg,Two,32.87,3,default
Notes from a Small Island (Notes From a Small Island #1),../../media/cache/8f/40/8f40ba4f73d2c70e0ccc15d77dc3c220.jpg,One,40.17,3,nonfiction
Night (The Night Trilogy #1),../../media/cache/b2/45/b245b0b715de260634e66a05a024cc52.jpg,One,13.51,3,nonfiction
Neither Here nor There: Travels in Europe,../../media/cache/c9/9a/c99a7a05537cd842eb4db83d537e3a4d.jpg,Three,38.95,3,travel
Naked,../../media/cache/80/2b/802b92421a7314b0a6afef8a9754cf5c.jpg,Three,31.69,3,humor
Morning Star (Red Rising #3),../../media/cache/53/4b/534bffd5988b0ddf6b587de76fa63d9a.jpg,One,29.40,3,default
"Miracles from Heaven: A Little Girl, Her Journey to Heaven, and Her Amazing Story of Healing",../../media/cache/60/cd/60cda3c756f14ef6625b979cfeb230ea.jpg,One,57.83,3,nonfiction
Midnight Riot (Peter Grant/ Rivers of London - books #1),../../media/cache/cd/65/cd65e4ee648ae23f6cdafb41e4948d6e.jpg,Two,55.46,3,fantasy
Me Talk Pretty One Day,../../media/cache/61/b2/61b220c2079a45a7975a397c8849e00e.jpg,Two,57.60,3,autobiography
Manuscript Found in Accra,../../media/cache/d9/54/d9540861f39f0b181b3fb13d57025f0c.jpg,Two,34.98,3,add-a-comment
Lust & Wonder,../../media/cache/25/1c/251ce4355601534338a646f2b63be93a.jpg,Two,11.87,3,autobiography
Lila (Gilead #3),../../media/cache/9b/37/9b37bcfb1a44dabbef36f5bf899df4b0.jpg,Three,12.47,3,fiction
"Life, the Universe and Everything (Hitchhiker's Guide to the Galaxy #3)",../../media/cache/54/ca/54cac05a3026d35e713133a1fe49f6c8.jpg,Two,33.26,3,science-fiction
Life Without a Recipe,../../media/cache/9e/4f/9e4fb935df3113056cc9bdee6cd09ea6.jpg,Five,59.04,3,autobiography
Life After Life,../../media/cache/60/4b/604b6a188b8ad3cfaeda67039399fcb6.jpg,Two,26.13,3,default
Letter to a Christian Nation,../../media/cache/88/21/8821ea9cd21326e41e095619b822a4a8.jpg,One,22.20,3,nonfiction
Let's Pretend This Never Happened: A Mostly True Memoir,../../media/cache/f5/8a/f58a15a50b2d70a4a8fd4fa6485a7009.jpg,One,45.11,3,nonfiction
Legend (Legend #1),../../media/cache/57/8f/578f1512a0f0a9d3c2ab9543f7b4506f.jpg,Four,43.69,3,young-adult
"Lean In: Women, Work, and the Will to Lead",../../media/cache/c2/4f/c24fc1d77ec9dd6e0c863484041c482f.jpg,One,25.02,3,default
