Name,Image Link,Rating,Price(£),In-Stock,Category
A Light in the Attic,../../media/cache/fe/72/fe72f0532301ec28892ae79a629a293c.jpg,Three,51.77,22,poetry
Tipping the Velvet,../../media/cache/08/e9/08e94f3731d7d6b760dfbfbc02ca5c62.jpg,One,53.74,20,historical-fiction
Soumission,../../media/cache/ee/cf/eecfe998905e455df12064dba399c075.jpg,One,50.10,20,fiction
Sharp Objects,../../media/cache/c0/59/c05972805aa7201171b8fc71a5b00292.jpg,Four,47.82,20,mystery
Sapiens: A Brief History of Humankind,../../media/cache/ce/5f/ce5f052c65cc963cf4422be096e915c9.jpg,Five,54.23,20,history
The Requiem Red,../../media/cache/6b/07/6b07b77236b7c80f42bd90bf325e69f6.jpg,One,22.65,19,young-adult
The Dirty Little Secrets of Getting Your Dream Job,../../media/cache/e1/1b/e11bea016d0ae1d7e2dd46fb3cb870b7.jpg,Four,33.34,19,business
"The Coming Woman: A Novel Based on the Life of the Infamous Feminist, Victoria Woodhull",../../media/cache/97/36/9736132a43b8e6e3989932218ef309ed.jpg,Three,17.93,19,default
The Boys in the Boat: Nine Americans and Their Epic Quest for Gold at the 1936 Berlin Olympics,../../media/cache/d1/2d/d12d26739b5369a6b5b3024e4d08f907.jpg,Four,22.60,19,default
The Black Maria,../../media/cache/d1/7a/d17a3e313e52e1be5651719e4fba1d16.jpg,One,52.15,19,poetry
"Starving Hearts (Triangular Trade Trilogy, #1)",../../media/cache/a0/7e/a07ed8f1c23f7b4baf7102722680bd30.jpg,Two,13.99,19,default
Shakespeare's Sonnets,../../media/cache/4d/7a/4d7a79a8be80a529b277ed5c4d8ba482.jpg,Four,20.66,19,poetry
Set Me Free,../../media/cache/b8/e9/b8e91bd2fc74c3954118999238abb4b8.jpg,Five,17.46,19,young-adult
Scott Pilgrim's Precious Little Life (Scott Pilgrim #1),../../media/cache/97/27/97275841c81e66d53bf9313cba06f23e.jpg,Five,52.29,19,sequential-art
Rip it Up and Start Again,../../media/cache/81/7f/817f5089c0e6e62738dce2931e7323d3.jpg,Five,35.02,19,music
"Our Band Could Be Your Life: Scenes from the American Indie Underground, 1981-1991",../../media/cache/ad/96/ad96e9c9f1664cbcb0e9627b007fb6f9.jpg,Three,57.25,19,music
Olio,../../media/cache/b1/0e/b10eabab1e1c811a6d47969904fd5755.jpg,One,23.88,19,poetry
Mesaerion: The Best Science Fiction Stories 1800-1849,../../media/cache/e8/1f/e81f850db9b9622c65619c9f15748de7.jpg,One,37.59,19,science-fiction
Libertarianism for Beginners,../../media/cache/91/a4/91a46253e165d144ef5938f2d456b88f.jpg,Two,51.33,19,politics
It's Only the Himalayas,../../media/cache/6d/41/6d418a73cc7d4ecfd75ca11d854041db.jpg,Two,45.17,19,travel
In Her Wake,../../media/cache/27/92/2792ef951651ff1eae40a410cac41e0f.jpg,One,12.84,19,thriller
How Music Works,../../media/cache/1d/40/1d4087ff0a63f09fae9cd8433d21c2c4.jpg,Two,37.32,19,music
"Foolproof Preserving: A Guide to Small Batch Jams, Jellies, Pickles, Condiments, and More: A Foolproof Guide to Making Small Batch Jams, Jellies, Pickles, Condiments, and More",../../media/cache/9f/58/9f58d3ff6d58589eaf325b1a33c303a0.jpg,Three,30.52,19,food-and-drink
Chase Me (Paris Nights #2),../../media/cache/6c/84/6c84fcf7a53b02b6e763de7272934842.jpg,Five,25.27,19,romance
Black Dust,../../media/cache/a4/0a/a40af95beab828af1a4757ad1ee17da3.jpg,Five,34.53,19,romance
Birdsong: A Story in Pictures,../../media/cache/af/2f/af2fe2419ea136f2cd567aa92082c3ae.jpg,Three,54.64,19,childrens
America's Cradle of Quarterbacks: Western Pennsylvania's Football Factory from Johnny Unitas to Joe Montana,../../media/cache/a3/2a/a32ab3b8c024c6c2b274a86b185e7585.jpg,Three,22.50,19,default
Aladdin and His Wonderful Lamp,../../media/cache/a8/3c/a83c460fab82f35a37c0846729485547.jpg,Three,53.13,19,default
Worlds Elsewhere: Journeys Around Shakespeareâs Globe,../../media/cache/7b/d9/7bd93db091d736d0c6ff9d578e3ba3d7.jpg,Five,40.30,18,nonfiction
Wall and Piece,../../media/cache/df/34/df346322ddfdd3b4da0e34cad17f49dc.jpg,Four,44.18,18,art
The Four Agreements: A Practical Guide to Personal Freedom,../../media/cache/2b/1b/2b1bfecae9d512cb6ee943ccf786216f.jpg,Five,17.66,18,spirituality
The Five Love Languages: How to Express Heartfelt Commitment to Your Mate,../../media/cache/7c/10/7c10101fe1759c5a17ba57e4bef9e764.jpg,Three,31.05,18,nonfiction
The Elephant Tree,../../media/cache/4b/80/4b80a3d9148e224ed4d6cd4d33f43728.jpg,Five,23.82,18,thriller
The Bear and the Piano,../../media/cache/d0/87/d0876dcd1a6530a4cb54903aad7a3e28.jpg,One,36.89,18,childrens
Sophie's World,../../media/cache/d7/39/d73914232130fdf90d66f02fd9798f2b.jpg,Five,15.94,18,philosophy
Penny Maybe,../../media/cache/b1/4b/b14be641ab97a330891455a769d52fd3.jpg,Three,33.29,18,default
Maude (1883-1993):She Grew Up with the country,../../media/cache/65/bf/65bfa3acc93b0e558a1c3de1b1164742.jpg,Two,18.02,18,default
"In a Dark, Dark Wood",../../media/cache/95/84/95840dfd67c020067c99d70451147e20.jpg,One,19.63,18,mystery
Behind Closed Doors,../../media/cache/a5/85/a58571db229f2e8f75ea38861eca7f39.jpg,Four,52.22,18,thriller
You can't bury them all: Poems,../../media/cache/b7/44/b7440aa88046b0bf8cba50d59295518e.jpg,Two,33.63,17,poetry
Slow States of Collapse: Poems,../../media/cache/db/ac/dbac3faca8a799824f5725d66c0fcce3.jpg,Three,57.31,17,poetry
Reasons to Stay Alive,../../media/cache/f5/3c/f53c7d21723c860cfbca2b539bc55b8f.jpg,Two,26.41,17,nonfiction
Private Paris (Private #10),../../media/cache/05/87/0587ab519222a61f803fa4570c325ad2.jpg,Five,47.61,17,fiction
#HigherSelfie: Wake Up Your Life. Free Your Soul. Find Your Tribe.,../../media/cache/71/45/71451e3bba61a8d888a4a2c6526a4bcf.jpg,Five,23.11,17,nonfiction
Without Borders (Wanderlove #1),../../media/cache/de/26/de269ee688d4dc51846567f3942600ce.jpg,Two,45.07,16,new-adult
When We Collided,../../media/cache/17/db/17db3de71e8217d4277a9328b04f56cf.jpg,One,31.77,16,contemporary
"We Love You, Charlie Freeman",../../media/cache/87/a2/87a2fddd7f6b240c0351e1eb950b6716.jpg,Five,50.27,16,fiction
Untitled Collection: Sabbath Poems 2014,../../media/cache/65/6e/656e79dfd4f8b6bf19ffde2c75ceda81.jpg,Four,14.27,16,poetry
"Unseen City: The Majesty of Pigeons, the Discreet Charm of Snails & Other Wonders of the Urban Wilderness",../../media/cache/88/a4/88a4b5f7236b8a36ba972be5ebe4f252.jpg,Four,44.18,16,nonfiction
Unicorn Tracks,../../media/cache/9b/09/9b0935dc936c92900c2dc5d2114da72f.jpg,Three,18.78,16,fantasy
"Unbound: How Eight Technologies Made Us Human, Transformed Society, and Brought Our World to the Brink",../../media/cache/27/a1/27a1ebe79d6e6759ec68ea9f427a4f71.jpg,One,25.52,16,history
Tsubasa: WoRLD CHRoNiCLE 2 (Tsubasa WoRLD CHRoNiCLE #2),../../media/cache/8b/ab/8bab133ec9f8248a8d5f5ea5c09d0f56.jpg,One,16.28,16,sequential-art
Throwing Rocks at the Google Bus: How Growth Became the Enemy of Prosperity,../../media/cache/f4/21/f4210912ca58ef35f8ad120fe3dfed38.jpg,Three,31.12,16,nonfiction
This One Summer,../../media/cache/ee/43/ee4364a59d66bafb1b3264419ab3ed9e.jpg,Four,19.49,16,sequential-art
Thirst,../../media/cache/8c/54/8c54a50576c204b80165a13545f73028.jpg,Five,17.27,16,fiction
The Torch Is Passed: A Harding Family Story,../../media/cache/c7/26/c7260547c468dbe78af92cf3927c2a1c.jpg,One,19.09,16,add-a-comment
The Secret of Dreadwillow Carse,../../media/cache/7b/fd/7bfde4a3d6793f13e9a2d8851a398847.jpg,One,56.13,16,childrens
"The Pioneer Woman Cooks: Dinnertime: Comfort Classics, Freezer Food, 16-Minute Meals, and Other Delicious Ways to Solve Supper!",../../media/cache/fd/af/fdaf3c3104c559941c01e840fecd2659.jpg,One,56.41,16,food-and-drink
The Past Never Ends,../../media/cache/9d/f2/9df248dcefeaba9eeb519a59b248f72c.jpg,Four,56.50,16,mystery
The Natural History of Us (The Fine Art of Pretending #2),../../media/cache/da/b8/dab87c14168f3ce18530447ec6437361.jpg,Three,45.22,16,young-adult
The Nameless City (The Nameless City #1),../../media/cache/19/de/19deee0778c2406da04a4dd0ea09188f.jpg,Four,38.16,16,sequential-art
The Murder That Never Was (Forensic Instincts #5),../../media/cache/29/e0/29e036acd8a6e3daa787ce2bc05bdbbb.jpg,Three,54.11,16,fiction
The Most Perfect Thing: Inside (and Outside) a Bird's Egg,../../media/cache/a3/9e/a39e7c5c9fc61c2ae0f81116aa8cbb0e.jpg,Four,42.96,16,science
"The Mindfulness and Acceptance Workbook for Anxiety: A Guide to Breaking Free from Anxiety, Phobias, and Worry Using Acceptance and Commitment Therapy",../../media/cache/c9/eb/c9eb6ecf45abf796df0044600db65e55.jpg,Four,23.89,16,add-a-comment
The Life-Changing Magic of Tidying Up: The Japanese Art of Decluttering and Organizing,../../media/cache/26/65/2665876e19a6c92130f02cfda3bd3846.jpg,Three,16.77,16,nonfiction
"The Inefficiency Assassin: Time Management Tactics for Working Smarter, Not Longer",../../media/cache/a5/b8/a5b8d2d5165a06fc762e8eaf8b04f98f.jpg,Five,20.59,16,default
The Gutsy Girl: Escapades for Your Life of Epic Adventure,../../media/cache/73/cb/73cb1236d96f455d712516fffeae2304.jpg,One,37.13,16,nonfiction
The Electric Pencil: Drawings from Inside State Hospital No. 3,../../media/cache/b1/0f/b10faf0dee8994865437ffc79682dc2f.jpg,One,56.06,16,nonfiction
The Death of Humanity: and the Case for Life,../../media/cache/3f/f6/3ff6fe5d0c5ca7ab2ed8b5971e299caa.jpg,Four,58.11,16,philosophy
"The Bulletproof Diet: Lose up to a Pound a Day, Reclaim Energy and Focus, Upgrade Your Life",../../media/cache/9c/c6/9cc673854af8fd155953384b3cac334e.jpg,Three,49.05,16,health
The Art Forger,../../media/cache/f5/3b/f53bc7b18914c97de7c23967293be119.jpg,Three,40.76,16,add-a-comment
The Age of Genius: The Seventeenth Century and the Birth of the Modern Mind,../../media/cache/2e/65/2e654066306042f4c462ba4d048650d9.jpg,One,19.73,16,history
The Activist's Tao Te Ching: Ancient Advice for a Modern Revolution,../../media/cache/da/0c/da0ca35421a5120b2109028e44a53f56.jpg,Five,32.24,16,spirituality
Spark Joy: An Illustrated Master Class on the Art of Organizing and Tidying Up,../../media/cache/17/19/1719475c51206a410a90fe5f3708df4c.jpg,Four,41.83,16,nonfiction
Soul Reader,../../media/cache/cc/5e/cc5e82c2205da748c6c19fbc1876586b.jpg,Two,39.58,16,default
Security,../../media/cache/79/2b/792bdeb2cf7d8efaef0e401e5a27b4da.jpg,Two,39.25,16,horror
"Saga, Volume 6 (Saga (Collected Editions) #6)",../../media/cache/4a/99/4a996ae54711cea37e370428b54f8b19.jpg,Three,25.02,16,fantasy
"Saga, Volume 5 (Saga (Collected Editions) #5)",../../media/cache/60/3c/603c8f3dd299efe67616a53e5bfb1d03.jpg,Two,51.04,16,sequential-art
Reskilling America: Learning to Labor in the Twenty-First Century,../../media/cache/2c/d2/2cd2b814b8a8cd3a49895cbd13a8b1f4.jpg,Two,19.83,16,nonfiction
"Rat Queens, Vol. 3: Demons (Rat Queens (Collected Editions) #11-15)",../../media/cache/d5/d0/d5d015a9cf899301cce5d1a629bdd974.jpg,Three,50.40,16,sequential-art
"Princess Jellyfish 2-in-1 Omnibus, Vol. 01 (Princess Jellyfish 2-in-1 Omnibus #1)",../../media/cache/6c/8f/6c8ffe949fb650ba60eff25be1692881.jpg,Five,13.61,16,sequential-art
Princess Between Worlds (Wide-Awake Princess #5),../../media/cache/db/01/db01b38d3200a5faff4ead42791416e4.jpg,Five,13.34,16,fantasy
"Pop Gun War, Volume 1: Gift",../../media/cache/6f/7b/6f7b3b8445b943f4ff7426360daefb88.jpg,One,18.97,16,sequential-art
"Political Suicide: Missteps, Peccadilloes, Bad Calls, Backroom Hijinx, Sordid Pasts, Rotten Breaks, and Just Plain Dumb Mistakes in the Annals of American Politics",../../media/cache/31/e6/31e6e0a41e62858180b268c27b20a770.jpg,Two,36.28,16,history
Patience,../../media/cache/71/0c/710cdaa148f10aac35c27bb93b4f532e.jpg,Three,10.16,16,sequential-art
"Outcast, Vol. 1: A Darkness Surrounds Him (Outcast #1)",../../media/cache/0c/8a/0c8ae80b592bc1b4c555d6b29d1cfa28.jpg,Four,15.44,16,sequential-art
orange: The Complete Collection 1 (orange: The Complete Collection #1),../../media/cache/33/0b/330bf57e3f2e70548f87d39cb956f7eb.jpg,One,48.41,16,sequential-art
Online Marketing for Busy Authors: A Step-By-Step Guide,../../media/cache/49/e1/49e1f207b2149e34390a2c6aa7cfc113.jpg,One,46.35,16,self-help
On a Midnight Clear,../../media/cache/75/9d/759d9276739200e2cb8101a36449ba20.jpg,Three,14.07,16,add-a-comment
Obsidian (Lux #1),../../media/cache/88/3f/883fb0f2304efca8724c629f03a4b82a.jpg,Two,14.86,16,young-adult
My Paris Kitchen: Recipes and Stories,../../media/cache/ae/d5/aed548aefcac7803a599b05da3acb86e.jpg,Two,33.37,16,food-and-drink
Masks and Shadows,../../media/cache/05/c4/05c43fe821ae19169c7baa8a54c7e869.jpg,Two,56.40,16,fantasy
"Mama Tried: Traditional Italian Cooking for the Screwed, Crude, Vegan, and Tattooed",../../media/cache/48/19/48192cbef9101060e3787d87d7c8d7d1.jpg,Four,14.02,16,food-and-drink
"Lumberjanes, Vol. 2: Friendship to the Max (Lumberjanes #5-8)",../../media/cache/67/f8/67f83a06f77d0ff3b06cb8ac04839422.jpg,Two,46.91,16,sequential-art
"Lumberjanes, Vol. 1: Beware the Kitten Holy (Lumberjanes #1-4)",../../media/cache/1c/78/1c78cb31ededc4c662857cf65bd1619d.jpg,Three,45.61,16,sequential-art
Lumberjanes Vol. 3: A Terrible Plan (Lumberjanes #9-12),../../media/cache/d6/9b/d69b7020c4210e12882ffca0428919a2.jpg,Two,19.92,16,sequential-art
"Layered: Baking, Building, and Styling Spectacular Cakes",../../media/cache/73/06/7306b860c7887dfb2a4b0083e2d6bf0d.jpg,One,40.11,16,food-and-drink
Judo: Seven Steps to Black Belt (an Introductory Guide for Beginners),../../media/cache/6d/80/6d80608ef81001ad068df06fae44b7f8.jpg,Two,53.90,16,add-a-comment
Join,../../media/cache/df/64/df642e483f7ae23de6888c73f05e2014.jpg,Five,35.67,16,science-fiction
In the Country We Love: My Family Divided,../../media/cache/11/08/1108a8d9ebccd9cd474012121c32a7f5.jpg,Four,22.00,16,nonfiction
Immunity: How Elie Metchnikoff Changed the Course of Modern Medicine,../../media/cache/e1/1e/e11e7e9514a123aee2415a1def85e638.jpg,Five,57.36,16,science
"I Hate Fairyland, Vol. 1: Madly Ever After (I Hate Fairyland (Compilations) #1-5)",../../media/cache/58/e2/58e2097169e92a95d973da420ce7cc98.jpg,Two,29.17,16,sequential-art
I am a Hero Omnibus Volume 1,../../media/cache/f7/4d/f74db5141becf01083abc03c078f4922.jpg,Three,54.63,16,sequential-art
How to Be Miserable: 40 Strategies You Already Use,../../media/cache/b0/9d/b09d7cb6aa8ae112dd457e588762d293.jpg,One,46.03,16,self-help
Her Backup Boyfriend (The Sorensen Family #1),../../media/cache/41/ee/41ee38c1d15f0139a3fb17b730dc4347.jpg,One,33.97,16,romance
"Giant Days, Vol. 2 (Giant Days #5-8)",../../media/cache/d0/6f/d06ff4e3b9daf93b18bb21f1af19b5eb.jpg,Two,22.11,16,sequential-art
Forever and Forever: The Courtship of Henry Longfellow and Fanny Appleton,../../media/cache/f9/9e/f99e760b894d10c6e5ed578618918367.jpg,Three,29.69,16,historical-fiction
First and First (Five Boroughs #3),../../media/cache/01/a5/01a5285b17e7ec0e7e56294a8f8af28d.jpg,Four,15.97,16,romance
Fifty Shades Darker (Fifty Shades #2),../../media/cache/51/86/51862681bebec59be61f36f937c71fce.jpg,One,21.96,16,romance
Everydata: The Misinformation Hidden in the Little Data You Consume Every Day,../../media/cache/15/97/15972684c6f44f1be5e751d2e067cc16.jpg,Two,54.35,16,nonfiction
"Don't Be a Jerk: And Other Practical Advice from Dogen, Japan's Greatest Zen Master",../../media/cache/a7/9c/a79cac7aec3816fb754c1aedd2e82986.jpg,Two,37.97,16,religion
Danganronpa Volume 1,../../media/cache/ce/39/ce3942d9a10b6a17805136ace7c140fa.jpg,Four,51.99,16,sequential-art
Crown of Midnight (Throne of Glass #2),../../media/cache/b7/7d/b77d5e56daa3c22822abf1b8affbaef9.jpg,Three,43.29,16,fantasy
"Codename Baboushka, Volume 1: The Conclave of Death",../../media/cache/ed/a5/eda54d1bfcdd39488013f7aae1eaf659.jpg,Four,36.72,16,sequential-art
Camp Midnight,../../media/cache/7a/67/7a671ecf69cdcd2ea9ebe85da1b5585f.jpg,Four,17.08,16,sequential-art
Call the Nurse: True Stories of a Country Nurse on a Scottish Isle,../../media/cache/c5/f2/c5f2361aab546bc7f851cf93aec94ca3.jpg,Five,29.14,16,nonfiction
Burning,../../media/cache/9a/2c/9a2c2936fa9bd422be96805924e1411a.jpg,Three,28.81,16,young-adult
Bossypants,../../media/cache/94/34/943490007d42c0bc066efc899dafa472.jpg,Two,49.46,16,default
"Bitch Planet, Vol. 1: Extraordinary Machine (Bitch Planet (Collected Editions))",../../media/cache/9d/1d/9d1d68362670066b155936e37d61bc5b.jpg,Two,37.92,16,sequential-art
"Avatar: The Last Airbender: Smoke and Shadow, Part 3 (Smoke and Shadow #3)",../../media/cache/9f/25/9f25ffe4229a32d1368b3dfe248c3343.jpg,Two,28.09,16,fantasy
Algorithms to Live By: The Computer Science of Human Decisions,../../media/cache/28/ea/28ea530a8b7955e422df64beaed7871a.jpg,One,30.81,16,nonfiction
A World of Flavor: Your Gluten Free Passport,../../media/cache/0a/6a/0a6a53a8d37584a7906d2d5a0032f9c1.jpg,One,42.95,16,default
"A Piece of Sky, a Grain of Rice: A Memoir in Four Meditations",../../media/cache/09/6d/096df83de35d408278fdc9108d930b5f.jpg,Five,56.76,16,default
A Murder in Time,../../media/cache/cc/bd/ccbd7a62caefd5a3a2e04dd7c2ff48fe.jpg,One,16.64,16,mystery
A Flight of Arrows (The Pathfinders #2),../../media/cache/ec/65/ec651ed66822d4b68938afa645b1ece2.jpg,Five,55.53,16,historical-fiction
A Fierce and Subtle Poison,../../media/cache/ac/b6/acb65d6d11263ba98b0191b544f6c728.jpg,Four,28.13,16,young-adult
A Court of Thorns and Roses (A Court of Thorns and Roses #1),../../media/cache/0a/78/0a78f89fc2dc78b700b494c3510e8920.jpg,One,52.37,16,fantasy
(Un)Qualified: How God Uses Broken People to Do Big Things,../../media/cache/e4/f8/e4f8c1c5954e09cb6c485d9db824eeb1.jpg,Five,54.00,16,christian
You Are What You Love: The Spiritual Power of Habit,../../media/cache/52/9b/529bf0d806ae2ab02bf23da4326b24c3.jpg,Four,21.87,15,religion
"William Shakespeare's Star Wars: Verily, A New Hope (William Shakespeare's Star Wars #4)",../../media/cache/02/7a/027a1f131d94c38f9e785f5d85a109c7.jpg,Four,43.30,15,science-fiction
Tuesday Nights in 1980,../../media/cache/a3/ad/a3ade5edecde67449329c1ebb016c049.jpg,Two,21.04,15,fiction
Tracing Numbers on a Train,../../media/cache/0a/05/0a0514153dac092aac76b097b495f908.jpg,Three,41.60,15,default
Throne of Glass (Throne of Glass #1),../../media/cache/4e/8d/4e8d87d1cb5e876ddb50599a1d1b656e.jpg,Three,35.07,15,fantasy
Thomas Jefferson and the Tripoli Pirates: The Forgotten War That Changed American History,../../media/cache/77/79/777988a85de2269905bd8c2070a3cf58.jpg,One,59.64,15,history
Thirteen Reasons Why,../../media/cache/6d/7b/6d7b69b4edcdf5b6b075d6fa53bf74bc.jpg,One,52.72,15,default
The White Cat and the Monk: A Retelling of the Poem âPangur BÃ¡nâ,../../media/cache/49/0e/490e049133ee9f398e6a70f25c12e308.jpg,Four,58.08,15,childrens
The Wedding Dress,../../media/cache/29/3b/293bd9cd6fe1f8c82d1688aefe6cc5f7.jpg,One,24.12,15,romance
The Vacationers,../../media/cache/34/c9/34c988a76c3cd7c04566d3030d8e7331.jpg,Four,42.15,15,fiction
The Third Wave: An Entrepreneurâs Vision of the Future,../../media/cache/0f/76/0f76b00ea914ced1822d8ac3480c485f.jpg,Five,12.61,15,business
The Stranger,../../media/cache/c8/1a/c81aea97de1daaa0081d96f8564c204c.jpg,Four,17.44,15,philosophy
The Shadow Hero (The Shadow Hero),../../media/cache/c3/d2/c3d2356443efca9bcad78eba8d249fc1.jpg,One,33.14,15,sequential-art
The Secret (The Secret #1),../../media/cache/d3/70/d37038f81b8ad0342346951271c31e58.jpg,Four,27.37,15,default
The Regional Office Is Under Attack!,../../media/cache/d4/73/d473f01f077b91ce04e345305a3fa217.jpg,Five,51.36,15,fiction
The Psychopath Test: A Journey Through the Madness Industry,../../media/cache/dd/63/dd637b4e7cb403932e6a29397d877e4e.jpg,Two,36.00,15,default
The Project,../../media/cache/4c/57/4c57c192057269132623f9c6b3f69559.jpg,One,10.65,15,science-fiction
The Power of Now: A Guide to Spiritual Enlightenment,../../media/cache/13/2a/132a17f55f0048a2f2df748c9f5ce4e4.jpg,Two,43.54,15,nonfiction
The Omnivore's Dilemma: A Natural History of Four Meals,../../media/cache/3d/9d/3d9d46815a4be5e5e6f5e641d8268961.jpg,Two,38.21,15,nonfiction
The Nerdy Nummies Cookbook: Sweet Treats for the Geek in All of Us,../../media/cache/41/57/4157492623f9552e3efdc858a19968f3.jpg,Five,37.34,15,food-and-drink
The Murder of Roger Ackroyd (Hercule Poirot #4),../../media/cache/86/38/8638ba095b3b32e0abdef170e7bc4fd6.jpg,Four,44.10,15,mystery
The Mistake (Off-Campus #2),../../media/cache/95/49/9549db6862283a388659611bda63b97b.jpg,Three,43.29,15,new-adult
The Matchmaker's Playbook (Wingmen Inc. #1),../../media/cache/e9/e3/e9e3736effeb4982324dd0e4e64b2e81.jpg,One,55.85,15,new-adult
The Love and Lemons Cookbook: An Apple-to-Zucchini Celebration of Impromptu Cooking,../../media/cache/88/e7/88e70e44632c3ca306191007bc723806.jpg,Two,37.60,15,food-and-drink
The Long Shadow of Small Ghosts: Murder and Memory in an American City,../../media/cache/2b/50/2b50fa031b2411a94bc68de0bbdd96fb.jpg,One,10.97,15,crime
The Kite Runner,../../media/cache/65/1e/651e956a041bf4b91bfba1374f0f91e7.jpg,Four,41.82,15,default
The House by the Lake,../../media/cache/46/a2/46a2c968bfccf1979cc5576085eec6dd.jpg,One,36.95,15,historical-fiction
The Glittering Court (The Glittering Court #1),../../media/cache/2f/21/2f21c9ffd0962092ce337ecd1b338f5b.jpg,One,44.28,15,fantasy
The Girl on the Train,../../media/cache/19/ed/19ed2156391eebbcd757a0d9f6d5860c.jpg,Two,55.02,15,default
The Genius of Birds,../../media/cache/2e/52/2e52982210cbc8dffe414cab72b52e38.jpg,One,17.24,15,nonfiction
The Emerald Mystery,../../media/cache/bc/1f/bc1f79af87032748b75d12079f51c031.jpg,Two,23.15,15,default
The Cookies & Cups Cookbook: 125+ sweet & savory recipes reminding you to Always Eat Dessert First,../../media/cache/81/37/81374b88e925ba998c4049abcf805196.jpg,One,41.25,15,food-and-drink
The Bridge to Consciousness: I'm Writing the Bridge Between Science and Our Old and New Beliefs.,../../media/cache/39/c7/39c7bebcde5d9643ede71ac8ee87ee69.jpg,Three,32.00,15,default
The Artist's Way: A Spiritual Path to Higher Creativity,../../media/cache/3b/41/3b414b6d0340a0cbbd05be0942ddaada.jpg,Five,38.49,15,nonfiction
The Art of War,../../media/cache/61/1b/611b527ab7ecef530e3040c85f6602c3.jpg,Five,33.34,15,default
The Argonauts,../../media/cache/22/d0/22d01c710471f94dabfa41083fa3cf4e.jpg,Two,10.93,15,autobiography
The 10% Entrepreneur: Live Your Startup Dream Without Quitting Your Day Job,../../media/cache/50/4b/504b1891508614ff9393563f69d66c95.jpg,Three,27.55,15,business
Suddenly in Love (Lake Haven #1),../../media/cache/58/bb/58bb81b052b6ad90adcd57e95da99a50.jpg,Two,55.99,15,romance
Something More Than This,../../media/cache/b8/f9/b8f9e0169c3811f9ed145c3824208de6.jpg,Four,16.24,15,romance
Soft Apocalypse,../../media/cache/61/ca/61ca5ab6bc514b9527af9f805fa03c31.jpg,Two,26.12,15,science-fiction
So You've Been Publicly Shamed,../../media/cache/9d/15/9d150a1d5832bb9e3b82bbc1541912d6.jpg,Two,12.23,15,nonfiction
Shoe Dog: A Memoir by the Creator of NIKE,../../media/cache/fc/21/fc21d144c7289e5b1cb133e01a925126.jpg,Two,23.99,15,business
"Shobu Samurai, Project Aryoku (#3)",../../media/cache/f3/7f/f37f3173a97baeac6b6421c54a6df7b5.jpg,Three,29.06,15,add-a-comment
Secrets and Lace (Fatal Hearts #1),../../media/cache/04/9d/049dafcbbc11bb61bb94e8b16f343936.jpg,One,20.27,15,default
Scarlett Epstein Hates It Here,../../media/cache/7e/ba/7eba21a2ecaa4651e44f04a7cd808520.jpg,Five,43.55,15,young-adult
Romero and Juliet: A Tragic Tale of Love and Zombies,../../media/cache/21/bc/21bc2104d32569a0dbbb81923480d749.jpg,One,36.94,15,default
Redeeming Love,../../media/cache/c9/74/c974d74fa0bd1735c6ae172d40b1c077.jpg,Five,20.47,15,christian-fiction
Poses for Artists Volume 1 - Dynamic and Sitting Poses: An Essential Reference for Figure Drawing and the Human Form,../../media/cache/a4/10/a4108800f6337c5aa13b104b252d52b8.jpg,One,41.06,15,default
Poems That Make Grown Women Cry,../../media/cache/18/ac/18ac3f16b10a5fc47e603d93335e3f24.jpg,Four,14.19,15,poetry
"Nightingale, Sing",../../media/cache/97/e6/97e65c8381cc80ba1107c3ce81c4878d.jpg,One,38.28,15,young-adult
Night Sky with Exit Wounds,../../media/cache/ff/48/ff48b0696fb97b7f7b5c6d15e372cb70.jpg,One,41.05,15,poetry
Mrs. Houdini,../../media/cache/b4/45/b445dbc81ca3aff1321a6bf0d0fa231d.jpg,Five,30.25,15,historical-fiction
Modern Romance,../../media/cache/78/cb/78cb28a3e8804131e8e0c3f7b8deb2fc.jpg,Five,28.26,15,add-a-comment
Miss Peregrineâs Home for Peculiar Children (Miss Peregrineâs Peculiar Children #1),../../media/cache/1d/ae/1dae4577eb25fcec3f88e4cbb3fc726a.jpg,One,10.76,15,default
Louisa: The Extraordinary Life of Mrs. Adams,../../media/cache/ec/2a/ec2a7df6fdafc7e6f97b6c6da7980584.jpg,Two,16.85,15,biography
Little Red,../../media/cache/63/6b/636b836f5c3d67b9cda1948f5ca08694.jpg,Three,13.47,15,childrens
Library of Souls (Miss Peregrineâs Peculiar Children #3),../../media/cache/79/7a/797a5468a7d06aba28d1cc7342b1f2ba.jpg,Five,48.56,15,young-adult
Large Print Heart of the Pride,../../media/cache/59/55/5955e9e333301e3eeb3b9575c2ad3659.jpg,Two,19.15,15,default
I Had a Nice Time And Other Lies...: How to find love & sh*t like that,../../media/cache/60/e9/60e9df360fec611b15a1bbb4c28aad22.jpg,Four,57.36,15,womens-fiction
Hollow City (Miss Peregrineâs Peculiar Children #2),../../media/cache/4c/fd/4cfd83a011f60d38b140642a441ce01a.jpg,One,42.98,15,fantasy
Grumbles,../../media/cache/20/78/207840aea0c8e2be66d998b80c6a59d3.jpg,Two,22.16,15,default
Full Moon over Noahâs Ark: An Odyssey to Mount Ararat and Beyond,../../media/cache/fe/8a/fe8af6ceec7718986380c0fde9b3b34f.jpg,Four,49.43,15,travel
Frostbite (Vampire Academy #2),../../media/cache/2a/2d/2a2d6ebcedeb7249a2a85fd1fbfd06e1.jpg,Five,29.99,15,young-adult
Follow You Home,../../media/cache/bb/c0/bbc0bdad3ad7f390017ea66bb7019579.jpg,One,21.36,15,horror
First Steps for New Christians (Print Edition),../../media/cache/c6/50/c650e687398b368f4a16276f6d00144b.jpg,One,29.00,15,default
Finders Keepers (Bill Hodges Trilogy #2),../../media/cache/76/80/76804e1881b630a110794fef5aad02cf.jpg,Five,53.53,15,fiction
"Fables, Vol. 1: Legends in Exile (Fables #1)",../../media/cache/51/e4/51e472da0b7be65921345af6d4ca9e51.jpg,Four,41.62,15,sequential-art
Eureka Trivia 6.0,../../media/cache/e8/21/e821a2e8fe4431eb895e9d46fe68c32e.jpg,Four,54.59,15,default
Drive: The Surprising Truth About What Motivates Us,../../media/cache/e9/48/e948a672efe721b408c8dd1f1f3ec529.jpg,Four,34.95,15,default
