Name,Image Link,Rating,Price(£),In-Stock,Category
Lilac Girls,../../media/cache/c0/80/c080a1626edf581b780420db13e7b074.jpg,Two,17.28,11,historical-fiction
Lies and Other Acts of Love,../../media/cache/8f/26/8f269de5ec7cef02e538eb0466c68f0c.jpg,One,45.14,11,fiction
Lab Girl,../../media/cache/26/ff/26ffcda626a5561e483afa19b58db8ac.jpg,One,40.85,11,autobiography
Keep Me Posted,../../media/cache/9c/84/9c845ad6a9d4ecf44d53ac0e3b8f54ae.jpg,Four,20.46,11,womens-fiction
It Didn't Start with You: How Inherited Family Trauma Shapes Who We Are and How to End the Cycle,../../media/cache/d3/26/d326484793116ccc786957d31e4fe912.jpg,Three,56.27,11,psychology
Grey (Fifty Shades #4),../../media/cache/c8/06/c806501c08d2b2cd72f2362a3da6ab80.jpg,Four,48.49,11,womens-fiction
"Exit, Pursued by a Bear",../../media/cache/fc/8c/fc8c996d0976a29c5c37bc11923a02f1.jpg,Four,51.34,11,young-adult
Daredevils,../../media/cache/79/47/79478ba5ab673fbdfe79a745a14fb9de.jpg,Three,16.34,11,fiction
Cravings: Recipes for What You Want to Eat,../../media/cache/7d/b4/7db4a7faaa0ea5134cabbb517bdd6cc7.jpg,Three,20.50,11,food-and-drink
Born for This: How to Find the Work You Were Meant to Do,../../media/cache/9f/e7/9fe7f6432f216b166cb36f16130f20f6.jpg,Five,21.59,11,business
Arena,../../media/cache/01/c5/01c50c5f341b8f1d030e9dffba5e5498.jpg,Four,21.36,11,science-fiction
Adultery,../../media/cache/f1/3b/f13bef3f1e05d0837bb46956a7a928f1.jpg,Five,20.88,11,default
A Mother's Reckoning: Living in the Aftermath of Tragedy,../../media/cache/32/86/32861b2d37c7b8da7bbce3a86a27123b.jpg,Three,19.53,11,nonfiction
A Gentleman's Position (Society of Gentlemen #3),../../media/cache/82/aa/82aa7770711dfc5edc1f5f69a731d08b.jpg,Five,14.75,11,romance
11/22/63,../../media/cache/4c/4c/4c4ce2398c6ad6c074e8061f739964cc.jpg,Three,48.48,11,fiction
"10% Happier: How I Tamed the Voice in My Head, Reduced Stress Without Losing My Edge, and Found Self-Help That Actually Works",../../media/cache/dd/89/dd8974991a279418738f38d5561979c4.jpg,Two,24.57,10,nonfiction
10-Day Green Smoothie Cleanse: Lose Up to 15 Pounds in 10 Days!,../../media/cache/79/84/7984ef7c568a60372f430c1ddae64034.jpg,Five,49.71,10,health
Without Shame,../../media/cache/6c/21/6c21a47589ec756b9ed27e2f331c08de.jpg,Five,48.27,9,add-a-comment
Watchmen,../../media/cache/a0/76/a07621adcf3e13b4d3bcdc0474ab2098.jpg,Four,58.05,9,add-a-comment
Unlimited Intuition Now,../../media/cache/0a/82/0a82c1dfd5b32349b8ce23bf6186553b.jpg,Four,58.87,9,default
Underlying Notes,../../media/cache/c1/76/c176e12e5d560240086270fa6b762d5d.jpg,Two,11.82,9,default
The Shack,../../media/cache/4c/ae/4cae2beda2d1c5f851f8971f94fdbc91.jpg,One,28.03,9,fiction
The New Brand You: Your New Image Makes the Sale for You,../../media/cache/74/34/74346ce51ac25a32c95ae9dc0d7ca515.jpg,Five,44.05,9,default
"The Moosewood Cookbook: Recipes from Moosewood Restaurant, Ithaca, New York",../../media/cache/c1/87/c187a9eb27d932f862ac06beec15c24c.jpg,Four,12.34,9,food-and-drink
The Flowers Lied,../../media/cache/55/c8/55c84e8714aa026c409ac63dc2a01434.jpg,Two,16.68,9,default
"The Fabric of the Cosmos: Space, Time, and the Texture of Reality",../../media/cache/b2/5a/b25a722c3bab8b311454bc251a75334a.jpg,One,55.91,9,science
The Book of Mormon,../../media/cache/d7/c8/d7c885771d5e843cc2db6b0e5183c0c5.jpg,Three,24.57,9,religion
The Art and Science of Low Carbohydrate Living,../../media/cache/82/f3/82f3b865f19faad855ec359f86415f79.jpg,Five,52.98,9,health
The Alien Club,../../media/cache/15/7c/157c526f6978d80e039e1362ae898fc8.jpg,One,54.40,9,young-adult
Suzie Snowflake: One beautiful flake (a self-esteem story),../../media/cache/59/13/5913f74507084d0cd47e2b73fd806f9e.jpg,Five,54.81,9,novels
Nap-a-Roo,../../media/cache/b9/43/b9437eda691f483d2174a1b94c8c9d06.jpg,One,25.08,9,childrens
"NaNo What Now? Finding your editing process, revising your NaNoWriMo book and building a writing career through publishing and beyond",../../media/cache/61/7b/617bd5deaa5ea47ae717cb81c9a81ce8.jpg,Four,10.41,9,default
Modern Day Fables,../../media/cache/53/da/53da160806b4854283b4477e5bf79522.jpg,Two,47.44,9,default
If I Gave You God's Phone Number....: Searching for Spirituality in America,../../media/cache/91/1a/911a12f954fc65fc4cc0e8a8f8b30750.jpg,One,20.91,9,spirituality
"Fruits Basket, Vol. 9 (Fruits Basket #9)",../../media/cache/3f/97/3f97ab9d27352e8dd24671c945b1c5ac.jpg,Four,33.95,9,sequential-art
Dress Your Family in Corduroy and Denim,../../media/cache/9c/2b/9c2bdd3040938c144345a115fb906562.jpg,Three,43.68,9,humor
Don't Forget Steven,../../media/cache/0e/ea/0eea83f8c3d5d3bf8538f046e2a4c67d.jpg,One,33.23,9,young-adult
Chernobyl 01:23:40: The Incredible True Story of the World's Worst Nuclear Disaster,../../media/cache/58/4a/584ac01e05ae76b1672f25a53384c617.jpg,Two,35.92,9,nonfiction
Art and Fear: Observations on the Perils (and Rewards) of Artmaking,../../media/cache/87/82/87822798b42545d589822bc712dc38a6.jpg,Four,48.63,9,art
A Shard of Ice (The Black Symphony Saga #1),../../media/cache/9d/9b/9d9bf1a3155fb3736d2fe12799dcca95.jpg,Three,56.63,9,fantasy
A Hero's Curse (The Unseen Chronicles #1),../../media/cache/f5/02/f502c42183ea69987a796d2e396b2bab.jpg,Three,50.49,9,add-a-comment
23 Degrees South: A Tropical Tale of Changing Whether...,../../media/cache/41/d7/41d75d4206b13bf107e86fa41f21afff.jpg,Two,35.79,9,add-a-comment
"Zero to One: Notes on Startups, or How to Build the Future",../../media/cache/f3/00/f30001f2851f82c266e2faa77bcdd924.jpg,Three,34.06,8,nonfiction
Why Not Me?,../../media/cache/66/95/6695cfb7ba5e0a6ef995300db6762fb6.jpg,One,17.76,8,nonfiction
When Breath Becomes Air,../../media/cache/26/9d/269d1774be6dd9e649c4170fbc8d27eb.jpg,Two,39.36,8,nonfiction
Vagabonding: An Uncommon Guide to the Art of Long-Term World Travel,../../media/cache/ca/30/ca30b1afe1e76ce7ba1db8176d398e53.jpg,Two,36.94,8,travel
The Unlikely Pilgrimage of Harold Fry (Harold Fry #1),../../media/cache/75/e4/75e444aca5ac86166a55cc7e64f5724f.jpg,Five,43.62,8,default
The New Drawing on the Right Side of the Brain,../../media/cache/0a/8f/0a8f6461714ec9868dea0d37c5da5a81.jpg,Three,43.02,8,art
"The Midnight Assassin: Panic, Scandal, and the Hunt for America's First Serial Killer",../../media/cache/38/ec/38ec5240eb37dfc9ebe54fa7584842ed.jpg,Four,28.45,8,nonfiction
The Martian (The Martian #1),../../media/cache/2e/58/2e5841f29d7212ba8df7dc1323689318.jpg,Two,41.39,8,default
The High Mountains of Portugal,../../media/cache/f3/28/f3285723c344576168d60806d266979a.jpg,One,51.15,8,fiction
The Grownup,../../media/cache/7e/cc/7ecc23cfaa84fb015a5333f2a5d97f23.jpg,One,35.88,8,short-stories
The E-Myth Revisited: Why Most Small Businesses Don't Work and What to Do About It,../../media/cache/a5/7e/a57ef7bdbaf704fca07ab6dd125b54f9.jpg,One,36.91,8,business
South of Sunshine,../../media/cache/34/65/3465383539467c7e1787d26c02bca66f.jpg,One,28.93,8,young-adult
Smarter Faster Better: The Secrets of Being Productive in Life and Business,../../media/cache/16/65/1665c94f1ec5580132a16c3bdfd0c421.jpg,Five,38.89,8,nonfiction
Silence in the Dark (Logan Point #4),../../media/cache/00/bf/00bf1ae17dde21c66e346dd9c393d6fa.jpg,Three,58.33,8,suspense
Shadows of the Past (Logan Point #1),../../media/cache/61/3a/613ac19c2232f1d9adc5943291a5e860.jpg,Five,39.67,8,christian-fiction
Roller Girl,../../media/cache/cf/cf/cfcfb88039ddab7d4ae399246529e401.jpg,Five,14.10,8,sequential-art
Rising Strong,../../media/cache/de/5c/de5c4ea75d455748861ce2bc844fb198.jpg,Three,21.82,8,nonfiction
Proofs of God: Classical Arguments from Tertullian to Barth,../../media/cache/f6/cb/f6cb2300a1235a344f1c11b2be9a605d.jpg,One,54.21,8,philosophy
Please Kill Me: The Uncensored Oral History of Punk,../../media/cache/8e/bb/8ebbba84c204b011527a8f4bd082b03f.jpg,Four,31.19,8,music
Out of Print: City Lights Spotlight No. 14,../../media/cache/4c/5a/4c5a559bc2edb79e5d48af4dbc813eb2.jpg,Five,53.64,8,poetry
My Life Next Door (My Life Next Door ),../../media/cache/1a/2c/1a2c80cc391bc1422013e31682c5f649.jpg,Five,36.39,8,young-adult
Miller's Valley,../../media/cache/a8/b9/a8b940d9bf27d6aedad73f0230c14f56.jpg,Two,58.54,8,fiction
Man's Search for Meaning,../../media/cache/97/da/97dac3668fcca2cf5af4e1bb971af546.jpg,Three,29.48,8,nonfiction
"Love That Boy: What Two Presidents, Eight Road Trips, and My Son Taught Me About a Parent's Expectations",../../media/cache/00/6e/006e242a10f2e27b71edfd1ca8020318.jpg,Two,25.06,8,nonfiction
Living Forward: A Proven Plan to Stop Drifting and Get the Life You Want,../../media/cache/06/bf/06bf33339562e138906eef6793ef53cd.jpg,Three,12.55,8,nonfiction
Les Fleurs du Mal,../../media/cache/3d/32/3d324c0b55c221e9b701d4e772b42ad6.jpg,Five,29.04,8,poetry
Left Behind (Left Behind #1),../../media/cache/11/74/11749e999f6ba7b9ef9408c624d1d71a.jpg,Two,40.72,8,default
Kill 'Em and Leave: Searching for James Brown and the American Soul,../../media/cache/d4/8e/d48ee3fe30d6d9b9cc550b76dae5984a.jpg,Five,45.05,8,music
Kierkegaard: A Christian Missionary to Christians,../../media/cache/bf/90/bf90ad2c3cab628096db8fca010797b4.jpg,One,47.13,8,philosophy
John Vassos: Industrial Design for Modern Life,../../media/cache/e8/d4/e8d47e80b92650728b837930cc578d63.jpg,Four,20.22,8,default
I'll Give You the Sun,../../media/cache/57/a8/57a87a9b1ed0de0e6d1c048f575f327f.jpg,One,56.48,8,default
I Will Find You,../../media/cache/58/08/58080dbe2c118867331f4ef932ca96c0.jpg,One,44.21,8,nonfiction
Hystopia: A Novel,../../media/cache/23/2f/232fdac6b00cd3c7cd2b2336ff3b730e.jpg,Four,21.96,8,fiction
Howl and Other Poems,../../media/cache/09/8e/098e81fcea9f6b4c15f6d207301c0085.jpg,Two,40.45,8,poetry
History of Beauty,../../media/cache/cb/74/cb74d2953d5249143c3c2e3c281daf6f.jpg,Four,10.29,8,art
Heaven is for Real: A Little Boy's Astounding Story of His Trip to Heaven and Back,../../media/cache/30/1d/301d6348c94fd869846aeadbeb15dad6.jpg,Two,52.86,8,default
Future Shock (Future Shock #1),../../media/cache/7c/eb/7cebcafb82ec5f208d1613b35337d59d.jpg,Five,55.65,8,young-adult
Ender's Game (The Ender Quintet #1),../../media/cache/4e/04/4e0497a5aa3d442acef6a3e5d0d3447c.jpg,One,43.64,8,default
Diary of a Citizen Scientist: Chasing Tiger Beetles and Other New Ways of Engaging the World,../../media/cache/29/5c/295ca7f5981786e8b2c6616d10158808.jpg,One,28.41,8,science
Death by Leisure: A Cautionary Tale,../../media/cache/bb/4e/bb4ec136d9d9e9796e1591ed9adb0e66.jpg,Four,37.51,8,default
Brilliant Beacons: A History of the American Lighthouse,../../media/cache/ba/59/ba5913de7abe0d9dbe9c8128092a52af.jpg,Three,11.45,8,history
Brazen: The Courage to Find the You That's Been Hiding,../../media/cache/4c/54/4c5479ee2b9edd4b2f22b888d139b08f.jpg,Two,19.22,8,nonfiction
Between the World and Me,../../media/cache/35/5f/355fa36362b722a241788d687fbc91af.jpg,Four,56.91,8,nonfiction
Being Mortal: Medicine and What Matters in the End,../../media/cache/73/ee/73ee61bd8724a36a83b691bb7b1a70b8.jpg,Four,55.06,8,nonfiction
"A Murder Over a Girl: Justice, Gender, Junior High",../../media/cache/98/e3/98e30c1a7b9f2acd9e44d77e0a7dbff1.jpg,Three,13.20,8,nonfiction
32 Yolks,../../media/cache/76/03/76038c9e795babed29d370097247c9a6.jpg,Two,53.63,8,food-and-drink
"""Most Blessed of the Patriarchs"": Thomas Jefferson and the Empire of the Imagination",../../media/cache/43/f2/43f25e9633b587a4052b517cd7b3b4a9.jpg,Five,44.48,8,history
You Are a Badass: How to Stop Doubting Your Greatness and Start Living an Awesome Life,../../media/cache/73/7e/737e4921bc14d72245aad1f21d7a3eef.jpg,Three,12.08,7,self-help
Wildlife of New York: A Five-Borough Coloring Book,../../media/cache/31/58/3158b1c362c0d9646e1696d2ed6c1ae1.jpg,Two,22.14,7,default
What Happened on Beale Street (Secrets of the South Mysteries #2),../../media/cache/2c/68/2c6857eb1c10995c8b9e77a1804f68cd.jpg,Five,25.37,7,mystery
Unreasonable Hope: Finding Faith in the God Who Brings Purpose to Your Pain,../../media/cache/80/43/804385d2b49e2f9e26a7d88b8ccaf62d.jpg,Two,46.33,7,spirituality
Under the Tuscan Sun,../../media/cache/45/21/4521c581ba727f5c835e34860cbf53e5.jpg,Three,37.33,7,travel
Toddlers Are A**holes: It's Not Your Fault,../../media/cache/26/1a/261a092ddd76981beb23a601edf0868b.jpg,One,25.55,7,humor
The Year of Living Biblically: One Man's Humble Quest to Follow the Bible as Literally as Possible,../../media/cache/e3/b8/e3b8b5a65135abbd9bdbd7a98baa1077.jpg,One,34.72,7,default
The Whale,../../media/cache/6c/df/6cdf7a3ee6cfd5ecbcfd37bd7a5c42e3.jpg,Four,35.96,7,childrens
The Story of Art,../../media/cache/7a/e9/7ae92da23efc2f0f4633f9d2cde370f3.jpg,Four,41.14,7,art
The Origin of Species,../../media/cache/d5/45/d54527d34174d5dd7eaeaaffdfcb3c5c.jpg,Four,10.01,7,science
The Great Gatsby,../../media/cache/21/69/21697f1564ae6776ca9280b17455c1b6.jpg,Four,36.05,7,default
The Good Girl,../../media/cache/00/f2/00f23edcef10a5ece4e179f08271f19c.jpg,Three,49.03,7,default
The Glass Castle,../../media/cache/38/03/3803cd158a57e03763dc2200f81eba65.jpg,One,16.24,7,add-a-comment
The Faith of Christopher Hitchens: The Restless Soul of the World's Most Notorious Atheist,../../media/cache/d7/cb/d7cbdb36b54398ba3876488726befc3d.jpg,One,39.55,7,biography
The Drowning Girls,../../media/cache/8f/83/8f83b65ba6a734aa7f40675b74a17c21.jpg,Three,35.67,7,add-a-comment
The Constant Princess (The Tudor Court #1),../../media/cache/ed/52/ed52651826bb23d853aead2753c9befc.jpg,Three,16.62,7,historical-fiction
The Bourne Identity (Jason Bourne #1),../../media/cache/fe/a4/fea443d174c2c9f0c7903f6c6a3ecc62.jpg,Four,42.78,7,fiction
The Bachelor Girl's Guide to Murder (Herringford and Watts Mysteries #1),../../media/cache/38/a4/38a44ac4f642f4717d865c81ec594529.jpg,Five,52.30,7,mystery
The Art Book,../../media/cache/76/90/76904c101329aa50b6653f399318970b.jpg,Two,32.34,7,art
The 7 Habits of Highly Effective People: Powerful Lessons in Personal Change,../../media/cache/08/3a/083ad6c527d14b1621806d17ed6f13e9.jpg,Four,33.17,7,default
Team of Rivals: The Political Genius of Abraham Lincoln,../../media/cache/be/22/be229bc9bc4655c7cb2c906998d5ef2e.jpg,Five,20.12,7,add-a-comment
Steal Like an Artist: 10 Things Nobody Told You About Being Creative,../../media/cache/6c/ea/6cea146ec9b4ee83061108782aef7d32.jpg,Two,20.90,7,default
"Sit, Stay, Love",../../media/cache/48/2c/482c14200688df579ab2ed0fcbddcb86.jpg,Three,20.90,7,romance
Sister Dear,../../media/cache/2a/0a/2a0a1543dd5f3edc407ab9989f29e992.jpg,Four,40.20,7,fiction
"Shrunken Treasures: Literary Classics, Short, Sweet, and Silly",../../media/cache/7b/b9/7bb9386b43f2aeaa6eaf042df1b4e96f.jpg,Three,52.87,7,childrens
"Rich Dad, Poor Dad",../../media/cache/46/1c/461cf454be3aac0b4cd066247c892679.jpg,One,51.74,7,business
Raymie Nightingale,../../media/cache/95/6b/956b5a8927463f4ea0774e2469e27ce5.jpg,Two,34.41,7,childrens
Playing from the Heart,../../media/cache/b6/ba/b6ba2393c312701f1471db91eb73284d.jpg,One,32.38,7,childrens
Nightstruck: A Novel,../../media/cache/cb/da/cbda49820de480220af3dff2d30c689a.jpg,Four,50.35,7,young-adult
"Naturally Lean: 125 Nourishing Gluten-Free, Plant-Based Recipes--All Under 300 Calories",../../media/cache/5b/46/5b466903acc905deb89019c0407848c4.jpg,Five,11.38,7,food-and-drink
Meternity,../../media/cache/e3/33/e33394096291284ed1f80c5b13c4e1f3.jpg,Three,43.58,7,womens-fiction
Memoirs of a Geisha,../../media/cache/5e/4b/5e4b5ef50c54f173456606e70719cc84.jpg,Three,49.67,7,fiction
Like Never Before (Walker Family #2),../../media/cache/1b/38/1b3825668326e82038ba33bca646e0f3.jpg,Two,28.77,7,christian-fiction
Life of Pi,../../media/cache/24/10/2410311e3603f15637eccedd14ba1130.jpg,Four,13.22,7,default
Leave This Song Behind: Teen Poetry at Its Best,../../media/cache/5e/ca/5eca840ed2d6f0f0d2f795922cb76741.jpg,Five,51.17,7,poetry
King's Folly (The Kinsman Chronicles #1),../../media/cache/fc/17/fc17b4149d87d9ee714dde082ede0ee9.jpg,Five,39.61,7,fantasy
John Adams,../../media/cache/fd/5f/fd5f36fce14114f5b982e1e69d9a2f69.jpg,Four,57.43,7,add-a-comment
How to Cook Everything Vegetarian: Simple Meatless Recipes for Great Food (How to Cook Everything),../../media/cache/ca/5f/ca5f20fe544cc311dd126c60c7aa003e.jpg,Four,46.01,7,food-and-drink
How to Be a Domestic Goddess: Baking and the Art of Comfort Cooking,../../media/cache/3b/67/3b673813904dce654eee394b9d308cfc.jpg,Two,28.25,7,food-and-drink
Good in Bed (Cannie Shapiro #1),../../media/cache/a5/7a/a57a35a22d7a06fa9987121e4883e4de.jpg,Five,37.05,7,add-a-comment
"Fruits Basket, Vol. 7 (Fruits Basket #7)",../../media/cache/c3/36/c3366ab246bf5e4baec15cdf55915b69.jpg,One,19.57,7,sequential-art
For the Love: Fighting for Grace in a World of Impossible Standards,../../media/cache/a9/f4/a9f4d0f649833b477383263a8c5fb217.jpg,Three,45.13,7,nonfiction
Finding God in the Ruins: How God Redeems Pain,../../media/cache/da/0f/da0f0c01b1b9819fa7cb5e27a295351f.jpg,Two,46.64,7,nonfiction
Every Heart a Doorway (Every Heart A Doorway #1),../../media/cache/b8/d7/b8d7eab895dac4551905c5f85849bb32.jpg,Five,12.16,7,fantasy
Delivering the Truth (Quaker Midwife Mystery #1),../../media/cache/5c/8a/5c8acde540a88aed464ab5c52bafcd83.jpg,Four,20.89,7,mystery
Counted With the Stars (Out from Egypt #1),../../media/cache/33/93/339372341b88e027734e97fa1ddb26fc.jpg,Five,17.97,7,christian-fiction
"Chronicles, Vol. 1",../../media/cache/df/bd/dfbd53a5c4bcb1bf676bf2a86335adbb.jpg,Two,52.60,7,music
Blue Like Jazz: Nonreligious Thoughts on Christian Spirituality,../../media/cache/98/4a/984ab50781e05461a753923eaba33e58.jpg,One,25.77,7,christian
Benjamin Franklin: An American Life,../../media/cache/c2/7e/c27efce6a2321c10b0d34035308ace37.jpg,Three,48.19,7,biography
"At The Existentialist CafÃ©: Freedom, Being, and apricot cocktails with: Jean-Paul Sartre, Simone de Beauvoir, Albert Camus, Martin Heidegger, Edmund Husserl, Karl Jaspers, Maurice Merleau-Ponty and others",../../media/cache/ce/da/ceda6d577d0609261f997bd99872013b.jpg,Five,29.93,7,philosophy
A Summer In Europe,../../media/cache/6c/e3/6ce3003931701c7a3fd5354917538ea9.jpg,Two,44.34,7,travel
A Short History of Nearly Everything,../../media/cache/17/aa/17aa3d17bae02fa1d0e2a831c0c0e58b.jpg,Five,52.40,7,history
A Gathering of Shadows (Shades of Magic #2),../../media/cache/c3/1a/c31af6fddfa452d9d746a599f35dcc01.jpg,Four,44.81,7,fantasy
The Sound Of Love,../../media/cache/90/df/90dfdcadfcff9cd39f6f933ac11c9241.jpg,Five,57.84,6,default
The Rise and Fall of the Third Reich: A History of Nazi Germany,../../media/cache/10/f6/10f6ebfa89b070ba39ad7c4c872c96ea.jpg,Two,39.67,6,history
The Perks of Being a Wallflower,../../media/cache/28/21/28219255776fb162c82ebac3cdddcf90.jpg,Three,55.02,6,default
The Mysterious Affair at Styles (Hercule Poirot #1),../../media/cache/6b/61/6b61d393f0731f6c52182ba3cf41e245.jpg,Four,24.80,6,mystery
The Man Who Mistook His Wife for a Hat and Other Clinical Tales,../../media/cache/d7/58/d758851b2790471b1de776f49a997157.jpg,Four,59.45,6,nonfiction
The Makings of a Fatherless Child,../../media/cache/2f/b6/2fb66b628ee51169b91cdfce8b68d929.jpg,Two,31.58,6,default
The Joy of Cooking,../../media/cache/2c/81/2c8137d1d0a3ebb2f74d7abf45916606.jpg,Four,43.27,6,add-a-comment
The Invention of Wings,../../media/cache/7a/b0/7ab00e6956f540bfe0018656d5bfe1e4.jpg,One,37.34,6,historical-fiction
The Hobbit (Middle-Earth Universe),../../media/cache/17/06/1706d016ec39ba3caad03b49737fefc7.jpg,Five,17.80,6,default
The Great Railway Bazaar,../../media/cache/d5/82/d582f6b0261c2842330e893962276295.jpg,One,30.54,6,travel
The Golden Compass (His Dark Materials #1),../../media/cache/a5/13/a513b65a8f7696c8aec48a607f7f90d3.jpg,One,18.77,6,add-a-comment
The God Delusion,../../media/cache/30/35/3035b6c5dc0a48a83fbe84eb37e76f10.jpg,Three,46.85,6,add-a-comment
The Girl You Left Behind (The Girl You Left Behind #1),../../media/cache/6d/72/6d72120f94d38e356612c8a78e82a53d.jpg,One,15.79,6,historical
The Fellowship of the Ring (The Lord of the Rings #1),../../media/cache/5d/9f/5d9f339be8d98f597ad33eee239119d8.jpg,Two,10.27,6,default
The Collected Poems of W.B. Yeats (The Collected Works of W.B. Yeats #1),../../media/cache/b3/8c/b38cadc69f4a2db0aae2ee2867ab8583.jpg,Five,15.42,6,poetry
The Barefoot Contessa Cookbook,../../media/cache/5f/c1/5fc1de838c428ae58f3a9ec08825d179.jpg,Five,59.92,6,food-and-drink
Tell the Wolves I'm Home,../../media/cache/78/48/784872c69237efaf5df8c0282280ff05.jpg,Two,50.96,6,young-adult
Ship Leaves Harbor: Essays on Travel by a Recovering Journeyman,../../media/cache/1e/d2/1ed2c2f8f406ed7ed90a58f73d4f1058.jpg,Three,30.60,6,default
Pride and Prejudice,../../media/cache/6a/87/6a8706826789aa47fbbb8a2459b4c616.jpg,Four,19.27,6,add-a-comment
Musicophilia: Tales of Music and the Brain,../../media/cache/ef/e7/efe7be2e15323d5bee36c37e953b1cad.jpg,One,46.58,6,default
Mere Christianity,../../media/cache/d7/ce/d7ce17649c77c9addfcf265012d0436e.jpg,Three,48.51,6,add-a-comment
Me Before You (Me Before You #1),../../media/cache/81/c3/81c36cb2510dc47892dde52f3989a53f.jpg,One,19.02,6,fiction
In the Woods (Dublin Murder Squad #1),../../media/cache/13/47/13470484ded8c835ce03b662fc863a1a.jpg,Two,38.38,6,mystery
In Cold Blood,../../media/cache/78/52/7852b87face58f30b46004a4a4270f2d.jpg,Four,49.98,6,nonfiction
How to Stop Worrying and Start Living,../../media/cache/64/0c/640cfc86cd3943cef402dc6082497eec.jpg,Five,46.49,6,self-help
Give It Back,../../media/cache/15/d4/15d444bf7fc91c7ced84e73ec99d711d.jpg,Two,18.32,6,thriller
"Girl, Interrupted",../../media/cache/9d/6c/9d6c5f23127bf494bc226daa02bc7daf.jpg,Three,42.14,6,nonfiction
Fun Home: A Family Tragicomic,../../media/cache/48/c1/48c15c510ce0089db10a4f5f9fce7ecd.jpg,Four,56.59,6,add-a-comment
"Fruits Basket, Vol. 6 (Fruits Basket #6)",../../media/cache/cd/b5/cdb5bd3a70cd857879120b4a90192bda.jpg,Four,20.96,6,sequential-art
Deception Point,../../media/cache/65/6d/656d264685962b55ff14fb310b0ae747.jpg,Four,40.32,6,fiction
"Death Note, Vol. 6: Give-and-Take (Death Note #6)",../../media/cache/c7/11/c7117547293ca3bb7a6a78e6603f2f8e.jpg,Three,36.39,6,sequential-art
Catherine the Great: Portrait of a Woman,../../media/cache/37/3a/373af6af58a00ca69602d74b81951ac4.jpg,Four,58.55,6,history
Better Homes and Gardens New Cook Book,../../media/cache/71/21/712105c4429489160c7a6f9e4824fcc6.jpg,Three,39.61,6,food-and-drink
An Unquiet Mind: A Memoir of Moods and Madness,../../media/cache/e5/65/e56540f5e29286f3d7a1e3eb1912b61f.jpg,Three,21.30,6,psychology
A Year in Provence (Provence #1),../../media/cache/8b/81/8b81cd9b2c8f89a12099a80bed1c4911.jpg,Four,56.88,6,travel
World Without End (The Pillars of the Earth #2),../../media/cache/58/b5/58b5730dd82cbcf6560cf0ab8b56cd9f.jpg,Four,32.97,5,historical-fiction
"Will Grayson, Will Grayson (Will Grayson, Will Grayson)",../../media/cache/b9/e6/b9e66a23fe4b95c426409bad86058152.jpg,Four,47.31,5,young-adult
Why Save the Bankers?: And Other Essays on Our Economic and Political Crisis,../../media/cache/be/98/be98641184d97b2fad1bc6c90c571b80.jpg,Two,48.67,5,nonfiction
Where She Went (If I Stay #2),../../media/cache/0c/f9/0cf93861d70a35c3d8deaa265a630e35.jpg,Four,41.73,5,young-adult
What If?: Serious Scientific Answers to Absurd Hypothetical Questions,../../media/cache/1f/5a/1f5a1bea2bd3e38dc105a7fe33a08826.jpg,Four,53.68,5,default
Two Summers,../../media/cache/cd/1a/cd1ab47070ea1662d4917d7ad483ed53.jpg,One,14.64,5,young-adult
This Is Your Brain on Music: The Science of a Human Obsession,../../media/cache/d8/d3/d8d3a16113069ccde25da34483a583fb.jpg,One,38.40,5,music
The Secret Garden,../../media/cache/f1/78/f17805e88aed31aae352ab250b2a379d.jpg,Four,15.08,5,classics
The Raven King (The Raven Cycle #4),../../media/cache/2f/7f/2f7f108c7b56c6adac8510eb43ff4f79.jpg,Two,30.57,5,add-a-comment
The Raven Boys (The Raven Cycle #1),../../media/cache/68/b0/68b05bbf33c6b8e2914f35ad14a0d2d8.jpg,Four,57.74,5,fantasy
The Power Greens Cookbook: 140 Delicious Superfood Recipes,../../media/cache/21/65/21651189fd05220e11ea5a1bd99ce58b.jpg,Five,11.05,5,food-and-drink
The Metamorphosis,../../media/cache/9b/33/9b33c3c40c8d27054a3edf96cbf6a2fb.jpg,One,28.58,5,classics
The Mathews Men: Seven Brothers and the War Against Hitler's U-boats,../../media/cache/52/74/5274c64fbcb7ce4bbf427ed751f6cada.jpg,Five,42.91,5,history
The Little Paris Bookshop,../../media/cache/ed/25/ed2540d08b66683313ffee9241bfd926.jpg,Three,24.73,5,fiction
The Hiding Place,../../media/cache/74/92/74927818a922712c13999a8043f7f35c.jpg,Four,55.91,5,history
The Grand Design,../../media/cache/9b/69/9b696c2064d6ee387774b6121bb4be91.jpg,Three,13.76,5,science
The Firm,../../media/cache/30/64/3064d8c687f770efea3fabeac0cd2d6f.jpg,Three,45.56,5,fiction
The Fault in Our Stars,../../media/cache/4f/96/4f96ae30d8aefab78b9c8005197eb85f.jpg,One,47.22,5,default
The False Prince (The Ascendance Trilogy #1),../../media/cache/36/b1/36b1333456d4c6b28e90d1157d37bc0e.jpg,Five,56.00,5,fantasy
The Expatriates,../../media/cache/4a/96/4a96cd8c43ea6c74d5b8d9ce1d47c187.jpg,Two,44.58,5,fiction
The Dream Thieves (The Raven Cycle #2),../../media/cache/77/1a/771a0d24c0ed726761a4ad4a4327e7d8.jpg,One,34.50,5,default
The Darkest Corners,../../media/cache/8c/64/8c64037f38663260b91c275078ee882d.jpg,Five,11.33,5,young-adult
The Crossover,../../media/cache/25/fe/25fe373b974387a66ff1dea80f023ccb.jpg,Four,38.77,5,poetry
The 5th Wave (The 5th Wave #1),../../media/cache/01/d2/01d245f56c1d9a397caa3d956573616e.jpg,Two,11.83,5,default
Tell the Wind and Fire,../../media/cache/bf/77/bf77b0c1f1bda1cd7297325066a7f337.jpg,Three,45.51,5,fantasy
Tell Me Three Things,../../media/cache/92/a5/92a5e01c5067f65f03b316a328459f9f.jpg,One,41.81,5,young-adult
Talking to Girls About Duran Duran: One Young Man's Quest for True Love and a Cooler Haircut,../../media/cache/5d/62/5d62099546e3889ad385b13c62bc8874.jpg,Four,25.15,5,nonfiction
Siddhartha,../../media/cache/6b/5f/6b5fba0f415741ab61c0cf24d11933ab.jpg,Five,34.22,5,fiction
Shiver (The Wolves of Mercy Falls #1),../../media/cache/79/57/79574d160951e6703343c593ef1bae98.jpg,Five,16.23,5,default
Remember Me?,../../media/cache/56/6c/566cf3ec6a006c333f64c3f70992874d.jpg,Three,11.48,5,default
